,Unnamed: 0,title,quantity,price
6559,6559,Coloración permanente Deliplus 7 rubio medio,Caja ,"3,90 €"
6560,6560,Coloración permanente Garnier 6.0  rubio oscuro,Caja ,"3,65 €"
6561,6561,Coloración permanente L'Oréal 6 rubio oscuro,Caja ,"7,95 €"
6573,6573,Coloración permanente Deliplus 6 rubio oscuro,Caja ,"3,90 €"
6576,6576,Colorete compacto Deliplus 02,1 ud.,"4,00 €"
6580,6580,Coloración permanente Deliplus 7.3 rubio medio dorado,Caja ,"3,90 €"
6586,6586,Coloración permanente L'Oréal 7.3 rubio dorado,Caja ,"7,95 €"
6587,6587,Coloración permanente Deliplus 1 negro,Caja ,"3,90 €"
6589,6589,Colorete compacto Deliplus 02 pink,1 ud.,"4,00 €"
6600,6600,Colorete compacto Deliplus 01,1 ud.,"4,00 €"
6605,6605,Colorete compacto Deliplus 04 coral,1 ud.,"4,00 €"
6607,6607,Coloración permanente Garnier 1.0 ultra negro,Caja ,"3,65 €"
6614,6614,Coloración permanente Deliplus 2.10 negro azul,Caja ,"3,90 €"
6618,6618,Coloración permanente Deliplus 100 rubio platino natural,Caja ,"3,90 €"
6621,6621,Combinado frutos secos Hacendado,Bote ,"1,99 €"
6625,6625,Comprimidos efervescentes vitamina C Deliplus 500 mg sabor limón,Tubo ,"1,95 €"
6626,6626,Comino molido Hacendado,Bote ,"0,63 €"
6645,6645,Comino en grano Hacendado,Bote ,"0,80 €"
6650,6650,Comprimidos efervescentes magnesio Deliplus 300 mg sabor naranja,Tubo ,"2,20 €"
6692,6692,Comida peces tropicales Dr. Wu Tetra,Bote ,"2,99 €"
6699,6699,Papilla compota de manzana +4 meses Hacendado,2 tarritos x 130 g,"0,94 €"
6704,6704,Polvo compacto de sol Deliplus,1 ud.,"7,00 €"
6705,6705,Polvo compacto de sol oscuro Deliplus,1 ud.,"7,00 €"
6708,6708,Polvo compacto seda Deliplus 02,1 ud.,"6,00 €"
6712,6712,Polvo compacto matificante universal Deliplus,1 ud.,"6,00 €"
6713,6713,Colorete compacto multicolor Deliplus 04,1 ud.,"6,00 €"
6716,6716,Polvo compacto seda Deliplus 03,1 ud.,"6,00 €"
6718,6718,Colorete compacto Deliplus 03,1 ud.,"4,00 €"
6719,6719,Polvo compacto seda Deliplus 04,1 ud.,"6,00 €"
6720,6720,Polvo compacto seda Deliplus 01,1 ud.,"6,00 €"
6726,6726,Protegeslip y compresa 2 en 1 Deliplus Suave,Caja ,"1,60 €"
6727,6727,Lote hombre Como tú Fuerza,Caja ,"9,00 €"
6728,6728,Lote hombre Como tú Plata,Caja ,"9,50 €"
6729,6729,Lote hombre Como tú Fuerza,Caja ,"4,00 €"
6736,6736,Snack perro corazones Compy,Paquete ,"1,29 €"
6738,6738,Snack perro salchichas Compy,Paquete ,"1,50 €"
6745,6745,Hélices con vegetales Hacendado,Paquete ,"1,09 €"
6747,6747,Lejía con detergente Bosque Verde limón,Botella ,"0,98 €"
6752,6752,Mantequilla con sal Hacendado,Pastilla ,"1,50 €"
6755,6755,Lejía con detergente Estrella limón,Botella ,"1,69 €"
6761,6761,Mantequilla con sal Hacendado,Tarrina ,"1,65 €"
6763,6763,Tortellini con tres quesos Pagani,Paquete ,"0,85 €"
6765,6765,Yogur con frutas Hacendado,12 ud. x 125 g,"2,54 €"
6768,6768,Galantina con pistacho y trufa Hacendado finas lonchas,Paquete ,"1,54 €"
6774,6774,Lejía con detergente Estrella,Botella ,"1,69 €"
6776,6776,Tortellini con ricotta y espinacas Pagani,Paquete ,"0,99 €"
6784,6784,Yogur con mermelada de fresas Nutricia,4 ud. x 125 g,"1,50 €"
6786,6786,Galletas con mantequilla Hacendado,Paquete ,"1,00 €"
6802,6802,Palitos con frutos secos Hacendado,2 paquetes x 60 g,"0,95 €"
6803,6803,Limpiahogar con lejía Bosque Verde en gel,Botella ,"1,29 €"
6804,6804,Galletas con chocolate con leche Hacendado,Caja ,"1,10 €"
6805,6805,Margarina con sal Hacendado,Tarrina ,"0,80 €"
6808,6808,Crackers con sal Galbusera,Paquete ,"1,78 €"
6811,6811,Palitos con queso fundido La vaca que ríe,Caja ,"1,99 €"
6816,6816,Gofres con chocolate Punto Gofre,2 gofres x 140 g,"1,39 €"
6820,6820,Sobrasada con miel L'Illa especialidades,Tarrina ,"1,95 €"
6821,6821,Sorbete con limón Hacendado,Tarrina ,"1,85 €"
6823,6823,Muesli con frutas Hacendado,Paquete ,"1,59 €"
6836,6836,Limpiagafas con gamuza Disop,Spray ,"2,25 €"
6856,6856,Margarina con sal Tulipán,Tarrina ,"1,59 €"
6861,6861,Galletas Cookies Hacendado,Paquete ,"0,85 €"
6862,6862,Galletas cookies sin gluten y sin lactosa Hacendado,Paquete ,"1,75 €"
6869,6869,Copa crema de chocolate y nata Hacendado,4 ud. x 115 g,"0,85 €"
6873,6873,Copos trigo de espelta integral Hacendado,Paquete ,"1,50 €"
6877,6877,Copos de maíz Corn Flakes sin gluten Nestlé,Caja ,"2,00 €"
6879,6879,Copa de avellana Hacendado,2 ud. x 175 g,"1,00 €"
6880,6880,Copos de trigo integral fruta & fibra Hacendado,Caja ,"1,49 €"
6881,6881,Copos de trigo Chocodays Hacendado extrusionados y recubiertos,Caja ,"1,39 €"
6884,6884,Copa menstrual íntima talla L Deliplus,Caja ,"9,00 €"
6885,6885,Copa menstrual íntima talla M Deliplus,Caja ,"9,00 €"
6892,6892,Torreznos Hacendado,Paquete ,"1,40 €"
6895,6895,Cortezas Hacendado,Paquete ,"0,59 €"
6897,6897,Cordero al tajo,Bandeja ,"8,55 €"
6900,6900,Cortaúñas pies Filarmonica,Paquete ,"2,00 €"
6902,6902,Corta cutículas Filarmonica,Paquete ,"2,00 €"
6906,6906,Cortaúñas manos Filarmonica,Paquete ,"1,80 €"
6913,6913,Cordones marrones zapato de vestir,Paquete ,"1,20 €"
6918,6918,Espinacas cortadas,Paquete ,"1,00 €"
6919,6919,Lechugas corazón romana,Paquete ,"1,60 €"
6922,6922,Patatas corte fino Hacendado ultracongeladas,Paquete ,"1,15 €"
6927,6927,Patatas corte grueso Hacendado ultracongeladas,Paquete ,"1,85 €"
6931,6931,Lechuga corazón romana,Paquete ,"1,10 €"
6936,6936,Patatas corte grueso Hacendado ultracongeladas,Paquete ,"1,20 €"
6938,6938,Loción corporal 10% urea pura Deliplus,Bote ,"1,95 €"
6939,6939,Leche corporal nutritiva Nivea piel seca,Bote ,"4,65 €"
6941,6941,Crema corporal Nivea,Lata ,"3,35 €"
6944,6944,Exfoliante corporal mineral Seesee,Tarro ,"3,80 €"
6947,6947,Loción corporal reafirmante Q10 Nivea piel normal,Bote ,"5,75 €"
6953,6953,Loción corporal reafirmante Deliplus,Bote ,"2,20 €"
6954,6954,Exfoliante corporal con partículas de coco Deliplus,Bote ,"3,80 €"
6958,6958,Loción corporal infantil hidratante Deliplus,Bote ,"3,80 €"
6960,6960,Loción corporal vainilla Deliplus,Bote ,"2,00 €"
6961,6961,Loción corporal hydra & go Deliplus,Spray ,"3,60 €"
6966,6966,Crema corporal efecto luminosidad Deliplus,Bote ,"2,95 €"
6969,6969,Leche corporal bebé hidratante Nenuco,Botella ,"3,42 €"
6971,6971,Manteca corporal mineral Deliplus Mar Muerto,Tarro ,"3,80 €"
6975,6975,Colonia corporal infantil Disney Minnie,Bote ,"4,95 €"
6978,6978,Colonia corporal infantil Marvel Spiderman,Bote ,"4,95 €"
6980,6980,Lote corporal mujer My Moment,Caja ,"8,50 €"
6983,6983,Jamón serrano cortado a máquina,Paquete ,"2,14 €"
6985,6985,Patatas fritas corte ondulado Hacendado,Paquete ,"0,58 €"
6989,6989,Lechuga romana cortada,Paquete ,"1,10 €"
6995,6995,Láminas sin corteza de pan de molde blanco Hacendado,Paquete ,"1,50 €"
6997,6997,Vino fino Corredera D.O Montilla-Moriles,Botella ,"2,25 €"
6998,6998,Piparra dulce Corbí en aceite de oliva,Tarro ,"1,99 €"
7001,7001,Cuello de cordero,Bandeja ,"4,14 €"
7003,7003,Queso semicurado Entrepinares cortado en cuñitas,Pieza ,"3,18 €"
7006,7006,Queso curado Entrepinares cortado en cuñitas,Pieza ,"3,29 €"
7007,7007,Queso Edam Holland corona lonchas,Paquete ,"1,70 €"
7009,7009,Salmorejo al estilo cordobés Hacendado,3 mini bricks x 330 ml,"1,90 €"
7016,7016,Costilla de cerdo a tiras,Bandeja ,"4,00 €"
7020,7020,Vino tinto D.O Rioja Comportillo cosecha,Botella ,"2,30 €"
7021,7021,Vino rosado D.O Rioja Comportillo cosecha,Botella ,"2,35 €"
7024,7024,Vino tinto D.O Rioja Faustino VII cosecha,Botella ,"3,75 €"
7025,7025,Sazonador al horno y microondas pollo y costillas a las hierbas provenzales Hacendado,Caja ,"0,95 €"
7029,7029,Protegeslip maxi Deliplus Cotton,Caja ,"1,80 €"
7030,7030,Protegeslip normal Deliplus Cotton,Caja ,"1,60 €"
7031,7031,Vino tinto D.O Rioja Coto de Imaz reserva,Botella ,"8,25 €"
7032,7032,Vino tinto D.O Rioja El Coto crianza,Botella ,"5,85 €"
7046,7046,Crackers 30% integral Galbusera,Paquete ,"1,78 €"
7047,7047,Crakers tuc saladas Lu,Paquete ,"1,55 €"
7048,7048,Crackers sin gluten Hacendado con romero,Paquete ,"1,50 €"
7050,7050,Pan de fibra y sésamo Hacendado,Paquete ,"0,95 €"
7051,7051,Tostadas sin gluten Hacendado,Caja ,"1,45 €"
7052,7052,Galletas saladas salpicks Galbusera,Paquete ,"1,50 €"
7053,7053,Mini tartaletas Confiletas,Paquete ,"1,65 €"
7054,7054,Mini volovanes Confiletas,Paquete ,"1,12 €"
7055,7055,Volovanes Confiletas,Paquete ,"1,86 €"
7069,7069,Crepes rellenos de chocolate,Paquete ,"1,09 €"
7073,7073,Crema de soja Hacendado,Brick ,"1,00 €"
7077,7077,Crema de queso sabor suave Hacendado,Tarrina ,"0,90 €"
7080,7080,Crema para pies 10% urea pura Deliplus,Bote ,"1,70 €"
7088,7088,Crema limpiadora vitrocerámicas Vitroclen 3 en 1,Botella ,"4,90 €"
7089,7089,Crema de manos Karité Deliplus,Bote ,"1,29 €"
7091,7091,Crema de leche con avellanas Nocilla,Tarro ,"1,85 €"
7094,7094,Crema de queso semicurado Président,Tarrina ,"1,79 €"
7096,7096,Crema limpiadora vitrocerámicas Frosch con naranja,Botella ,"2,99 €"
7098,7098,Crema de manos concentrada Deliplus,Bote ,"1,25 €"
7104,7104,Crema facial hidratante equilibrante Deliplus piel normal a grasa,Tarro ,"2,50 €"
7107,7107,Crema de manos nutritiva Dove intensiva,Bote ,"2,00 €"
7112,7112,Crema de manos flor de Japón Deliplus,Tubo ,"1,00 €"
7114,7114,Crema de espárragos Hacendado,Sobre ,"0,55 €"
7115,7115,"Crema facial día 24K Gold progress Deliplus protectora FPS 10 rostro, cuello y escote",Tarro ,"5,00 €"
7119,7119,Crema cuello y escote reafirmante nutritiva Sisbela,Bote ,"5,00 €"
7120,7120,"Crema facial noche 24K Gold progress Deliplus multirreparadora rostro, cuello y escote",Tarro ,"5,00 €"
7124,7124,Crema facial efecto lifting Deliplus,Tarro ,"4,00 €"
7127,7127,Crema de manos delhi rose Deliplus,Tarro ,"2,30 €"
7142,7142,Crema protectora para pañal Johnson's,Tubo ,"3,30 €"
7145,7145,Crema di limoncello,Botella ,"6,85 €"
7147,7147,Crema reafirmante de senos Deliplus,Bote ,"6,00 €"
7157,7157,Crema depilatoria Veet for men piel normal,Bote ,"4,05 €"
7158,7158,Crema depilatoria de ducha Veet piel sensible,Bote ,"4,75 €"
7159,7159,Crema facial matificante hidratante,Tarro ,"6,00 €"
7160,7160,Crema facial con miel y jalea real Deliplus,Tarro ,"6,00 €"
7166,7166,Yogur cremoso Hacendado natural edulcorado,6 ud. x 125 g,"1,30 €"
7169,7169,Yogur cremoso Hacendado con melocotón y maracuya,Bote ,"0,69 €"
7172,7172,Yogur cremoso Hacendado con frutos silvestres,Bote ,"0,69 €"
7180,7180,Guante de crin exfoliante Deliplus,Paquete ,"2,15 €"
7182,7182,Lote hombre Criterio Ego,Caja ,"10,50 €"
7183,7183,Toallitas limpiadoras de cristales y espejos Bosque Verde,Paquete ,"1,25 €"
7186,7186,Eau de toilette hombre Criterio Ego,Frasco ,"9,00 €"
7187,7187,Vino tinto D.O Rioja Cune crianza,Botella ,"6,55 €"
7188,7188,Vino tinto D.O Rioja Comportillo crianza,Botella ,"2,90 €"
7192,7192,Vino tinto D.O Rioja Reservado crianza,3 ud. x 187 ml,"4,20 €"
7198,7198,Coloración permanente Garnier 9.13 rubio beige cristalino,Caja ,"3,65 €"
7204,7204,Picatostes tostados Hacendado,Paquete ,"0,65 €"
7205,7205,Picatostes fritos Hacendado,Paquete ,"0,75 €"
7207,7207,Croquetas de cocido Hacendado ultracongeladas,Paquete ,"1,50 €"
7208,7208,Croquetas de pollo Hacendado ultracongeladas,Paquete ,"0,99 €"
7209,7209,Croquetas de jamón Hacendado ultracongeladas,Paquete ,"0,99 €"
7210,7210,Croquetas de ibérico Hacendado ultracongeladas,Paquete ,"1,40 €"
7212,7212,Croquetas de setas Hacendado ultracongeladas,Paquete ,"1,50 €"
7213,7213,Croquetas de pollo,Bandeja ,"3,20 €"
7215,7215,Croquetas de merluza y gambas Preli ultracongeladas,Paquete ,"1,50 €"
7216,7216,Crocanrol de queso curado Hacendado ultracongelado,Paquete ,"2,00 €"
7218,7218,Croquetas de espinacas Hacendado ultracongeladas,Paquete ,"1,50 €"
7225,7225,Mini croquetas de jamón Hacendado ultracongeladas,Paquete ,"1,00 €"
7226,7226,Whisky Crocker Land,Botella ,"5,00 €"
7228,7228,Lote hombre Crossmen,Caja ,"10,00 €"
7233,7233,Regañá Hacendado,Paquete ,"0,68 €"
7240,7240,Grissini palitos de pan con sésamo Hacendado,2 paquetes x 100 g,"1,35 €"
7242,7242,Grissini palitos de pan Hacendado,Caja ,"1,50 €"
7252,7252,Muesli crujiente con chocolate Hacendado,Paquete ,"1,75 €"
7254,7254,Muesli crujiente con frutos secos Hacendado,Paquete ,"1,75 €"
7257,7257,Langostino crudo y pelado Pescanova ultracongelado,Paquete ,"3,25 €"
7258,7258,Muesli crunchy Hacendado,Paquete ,"1,25 €"
7259,7259,Muesli crujiente con fruta Hacendado,Paquete ,"1,59 €"
7260,7260,Langostino crudo Pescanova ultracongelado,Caja ,"9,25 €"
7262,7262,Langostino crudo ultracongelado,Granel ,"1,43 €"
7263,7263,Pulpo crudo grande Hacendado congelado,Paquete ,"16,84 €"
7264,7264,Navaja cruda Hacendado congelada,Bandeja ,"3,50 €"
7265,7265,Patatas fritas crujientes a la sartén Hacendado,2 paquetes x 150 g,"1,50 €"
7267,7267,Patatinas extra crujientes Hacendado,Paquete ,"0,95 €"
7269,7269,Maíz frito crujiente y tierno Hacendado,Paquete ,"0,95 €"
7271,7271,Escoba fibras cruzadas Bosque Verde,1 ud.,"2,10 €"
7276,7276,Patatas fritas extra crujientes Hacendado,Paquete ,"1,45 €"
7301,7301,Cuajada Hacendado,4 ud. x 125 g,"0,95 €"
7304,7304,Cuartos traseros de pollo congelados,Paquete ,"3,90 €"
7305,7305,Cuajada Danone,2 ud. x 135 g,"1,00 €"
7306,7306,La cuajada de leche de oveja Goshua,2 ud. x 140 g,"1,99 €"
7307,7307,Papilla cuatro frutas con avena +8 meses Hacendado,2 tarritos x 200 g,"1,65 €"
7308,7308,Papilla cuatro frutas con yogur +6 meses Hacendado,2 tarritos x 200 g,"1,65 €"
7310,7310,Medio conejo a cuartos,Bandeja ,"3,97 €"
7314,7314,Cubos de hielo Procubit,Paquete ,"0,69 €"
7318,7318,Cubo redondo 12L Bosque Verde,1 ud.,"2,35 €"
7319,7319,Cubo ovalado con ruedas 15L Bosque Verde,1 ud.,"3,00 €"
7321,7321,Cubos de hielo Procubit,5 paquetes x 2 kg,"3,25 €"
7324,7324,Escurridor para cubo ovalado Bosque Verde,1 ud.,"2,25 €"
7325,7325,Escurridor para cubo redondo Bosque Verde,1 ud.,"0,90 €"
7344,7344,Vasos pequeños de plástico Bosque Verde,Paquete ,"0,65 €"
7345,7345,Platos de plástico Bosque Verde,Paquete ,"1,30 €"
7346,7346,Vasos medianos de plástico Bosque Verde,Paquete ,"1,10 €"
7348,7348,Cucharas postre de plástico Bosque Verde,Paquete ,"1,10 €"
7350,7350,Plato postre de plástico Bosque Verde,Paquete ,"1,10 €"
7353,7353,Vasos licor de plástico Bosque Verde,Paquete ,"1,10 €"
7355,7355,Cucharas de plástico Bosque Verde,Paquete ,"1,30 €"
7356,7356,Tenedores de plástico Bosque Verde,Paquete ,"1,30 €"
7357,7357,Paletinas de plástico Bosque Verde,Paquete ,"1,10 €"
7360,7360,Cuchillos de plástico Bosque Verde,Paquete ,"1,30 €"
7363,7363,Plato decorado de plástico Bosque Verde,Paquete ,"1,80 €"
7366,7366,Mantel de papel decorado Papermon,1 ud.,"2,50 €"
7367,7367,Vasos grandes de plástico Bosque Verde,Paquete ,"1,50 €"
7370,7370,Flash popitos Hacendado,Paquete ,"1,00 €"
7375,7375,Helado de limón Hacendado,Caja ,"1,50 €"
7376,7376,Helado frutas Hacendado,Caja ,"2,00 €"
7377,7377,Helado sabor chocolate Hacendado,Caja ,"1,50 €"
7378,7378,Helado lima limón Hacendado,Caja ,"1,87 €"
7379,7379,Helado fresa Hacendado,Caja ,"1,87 €"
7380,7380,Helado de naranja Hacendado,Caja ,"1,50 €"
7381,7381,Granizado de horchata Hacendado,6 ud. x 200 ml,"2,30 €"
7382,7382,Granizado de limón Hacendado,6 ud. x 200 ml,"1,85 €"
7402,7402,Jamón serrano reserva cortado a cuchillo,Paquete ,"3,10 €"
7404,7404,Jamón gran reserva cortado a cuchillo,Paquete ,"3,60 €"
7426,7426,Maquinillas depilación mujer,Paquete ,"1,15 €"
7428,7428,Maquinillas depilación mujer,Paquete ,"2,00 €"
7432,7432,Maquinillas depilación Gillette Simply Venus,Paquete ,"1,99 €"
7433,7433,Maquinillas depilación Gillette Simply Venus,Paquete ,"3,45 €"
7435,7435,Recambios maquinilla depilación Gillette Venus,Paquete ,"9,85 €"
7437,7437,Recambios maquinilla Gillette Venus snap,Paquete ,"7,95 €"
7438,7438,Maquinilla depilación Hydro silk Wilkinson,Paquete ,"3,95 €"
7439,7439,Maquinilla de depilar Gillette Venus,Paquete ,"6,95 €"
7440,7440,Recambios maquinilla depilación Hydro silk Wilkinson,Paquete ,"7,25 €"
7442,7442,Maquinilla depilación Gillette Venus snap,Paquete ,"7,95 €"
7443,7443,Lentejas a la riojana Hacendado,Bote ,"0,98 €"
7444,7444,Lentejas a la jardinera Hacendado,Bote ,"0,79 €"
7446,7446,Fabada Hacendado,Bote ,"0,99 €"
7449,7449,Garbanzos a la jardinera Hacendado,Bote ,"0,79 €"
7452,7452,Garbanzos a la riojana Hacendado,Bote ,"0,85 €"
7456,7456,Fabada Hacendado,Bote ,"1,95 €"
7457,7457,Habas condimentadas La Parva,Bote ,"0,90 €"
7460,7460,Oreja guisada La Nora,Lata ,"1,85 €"
7461,7461,Perdiz en escabeche Polgri,Caja ,"8,90 €"
7465,7465,Galletas Oceanix Cuétara,Caja ,"1,40 €"
7470,7470,Toallitas limpiadoras de cuero Bosque Verde,Paquete ,"1,35 €"
7471,7471,Tequila reposado Jose Cuervo,Botella ,"13,80 €"
7488,7488,Gel refrescante mentol Deliplus para pies y piernas,Bote ,"2,50 €"
7501,7501,Spray refrescante mentol Deliplus para pies y piernas,Bote ,"3,95 €"
7504,7504,Tratamiento crema reductor intensivo noche Deliplus,Bote ,"5,50 €"
7529,7529,Toallitas íntimas cuidado diario Deliplus,Paquete ,"1,55 €"
7531,7531,Desodorante mujer cuidado seda Deliplus,Spray ,"1,40 €"
7532,7532,Toallitas íntimas cuidado diario Deliplus monodosis,Caja ,"2,00 €"
7534,7534,Toallitas íntimas cuidado diario Deliplus,Paquete ,"0,85 €"
7539,7539,Desodorante roll-on cuidado avena Deliplus,50 ml,"0,75 €"
7542,7542,Desodorante roll-on mujer cuidado seda Deliplus,50 ml,"0,75 €"
7545,7545,Lima fibra de vidrio Filarmonica,Paquete ,"1,00 €"
7548,7548,Lima esmeril para uñas Filarmonica,Paquete ,"1,20 €"
7549,7549,Palitos de naranjo Filarmonica,Paquete ,"1,35 €"
7551,7551,Reparador labial con omegas 3 y 6 Deliplus,15 ml,"2,60 €"
7553,7553,Tijera uñas Filarmonica,Paquete ,"4,20 €"
7554,7554,Quitaesmalte instantáneo manos Deliplus,Tarro ,"2,00 €"
7555,7555,Vaselina perfumada para labios Deliplus neutra,Tarro ,"1,60 €"
7557,7557,Peeling para labios Deliplus 06 Sandía,1 ud.,"4,50 €"
7558,7558,Lima métalica para uñas Filarmonica,Paquete ,"1,60 €"
7559,7559,Pastillas efervescentes manicura Deliplus,Paquete ,"3,75 €"
7560,7560,Vaselina perfumada para labios Deliplus frambuesa,Tarro ,"1,60 €"
7561,7561,Pulidor de uñas manos Luxor,Paquete ,"1,45 €"
7562,7562,Guías uñas manicura francesa Deliplus,Paquete ,"1,50 €"
7563,7563,Uñas postizas Deliplus,Paquete ,"4,50 €"
7585,7585,Discos desmaquillantes Deliplus redondos,Paquete ,"0,95 €"
7588,7588,Discos ovalados Deliplus,Paquete ,"1,70 €"
7594,7594,Mascarilla facial cremosa de coco Montagne Jeunesse,2 ud. x 8 ml,"1,50 €"
7612,7612,Tiras faciales limpia poros Doctor San,Caja ,"4,30 €"
7619,7619,Mascarilla facial hidratante Garnier revitalizante,Paquete ,"2,30 €"
7629,7629,Exfoliante facial Deliplus todo tipo de pieles,Bote ,"2,50 €"
7630,7630,Esponja facial desmaquillante Deliplus vegetal,Paquete ,"1,15 €"
7631,7631,Tónico facial hidratante Deliplus todo tipo de pieles,Bote ,"1,30 €"
7636,7636,Gel facial limpiador purificante Deliplus pieles grasas,Bote ,"3,75 €"
7644,7644,Contorno de ojos Sisbela,Bote ,"4,50 €"
7645,7645,Salchichón cular ibérico extra La Hacienda del ibérico,Pieza ,"5,45 €"
7649,7649,Salchichón cular ibérico extra La Hacienda del ibérico,Pieza ,"8,94 €"
7655,7655,Vela de cumpleaños 3 Hacendado,Paquete ,"0,75 €"
7656,7656,Vela de cumpleaños 1 Hacendado,Paquete ,"0,75 €"
7657,7657,Vela de cumpleaños 4 Hacendado,Paquete ,"0,75 €"
7658,7658,Vela de cumpleaños 2 Hacendado,Paquete ,"0,75 €"
7659,7659,Vela de cumpleaños 5 Hacendado,Paquete ,"0,75 €"
7660,7660,Vela de cumpleaños 7 Hacendado,Paquete ,"0,75 €"
7661,7661,Vela de cumpleaños 6 Hacendado,Paquete ,"0,75 €"
7662,7662,Vela de cumpleaños 8 Hacendado,Paquete ,"0,75 €"
7663,7663,Vela de cumpleaños 0 Hacendado,Paquete ,"0,75 €"
7664,7664,Velas de cumpleaños Hacendado,Paquete ,"0,90 €"
7665,7665,Vela de cumpleaños 9 Hacendado,Paquete ,"0,75 €"
7669,7669,Queso tierno Entrepinares cortado en cuñitas,Pieza ,"3,22 €"
7670,7670,Queso tierno de vaca Entrepinares cortado en cuñitas,Pieza ,"1,92 €"
7671,7671,Cuquitos sabor queso Hacendado,Paquete ,"0,60 €"
7672,7672,Garfitos de maíz sabor queso Hacendado,Paquete ,"0,45 €"
7673,7673,Cuquis Hacendado,Paquete ,"0,75 €"
7674,7674,Super cuquis La Llanura,10 paquetes x 6 g,"1,15 €"
7676,7676,Whisky escocés Cutty Sark,Botella ,"11,55 €"
7677,7677,Tratamiento para uñas gel quita-cutículas Deliplus,1 ud.,"2,95 €"
7678,7678,Eau de parfum mujer Hortensia H Jardín secreto cyprum,Frasco ,"11,00 €"
7681,7681,Queso en dados feta Hacendado,Tarrina ,"1,70 €"
7682,7682,Queso en dados para ensaladas Hacendado,Tarrina ,"1,60 €"
7683,7683,Neceser Daisy pequeño,1 ud.,"4,50 €"
7684,7684,Neceser 101 Dálmatas grande,1 ud.,"6,50 €"
7685,7685,Preservativos dame placer Durex,Caja ,"6,90 €"
7700,7700,Danonino sabor fresa Danone,6 ud. x 50 g,"1,09 €"
7703,7703,Danonino maxi sabor fresa Danone,4 ud. x 100 g,"1,69 €"
7705,7705,Yogur natural Danone,8 ud. x 120 g,"1,99 €"
7706,7706,Yogur sabores Danone,12 ud. x 120 g,"2,78 €"
7710,7710,Yogur sabor fresa Danone,4 ud. x 120 g,"1,09 €"
7711,7711,Natillas de vainilla Danet,8 ud. x 125 g,"2,78 €"
7714,7714,Yogur sabor limón Danone,4 ud. x 120 g,"1,09 €"
7716,7716,Yogur sabor macedonia Danone,4 ud. x 120 g,"1,09 €"
7717,7717,Yogur sabor coco Danone,4 ud. x 120 g,"1,09 €"
7718,7718,Natillas de chocolate Danet,8 ud. x 125 g,"2,78 €"
7722,7722,Postre de soja Savia Danone natural edulcorado,6 ud. x 120 g,"2,49 €"
7728,7728,Eau de toilette mujer Shakira Dance,Frasco ,"8,95 €"
7747,7747,Dátiles sin hueso Hacendado,Paquete ,"2,34 €"
7756,7756,Decoraciones de colores Hacendado,Paquete ,"1,05 €"
7757,7757,Decolorante de tejidos sin lejía La Nave,Caja ,"1,80 €"
7770,7770,Sirope de chocolate Hacendado,Bote ,"1,45 €"
7775,7775,Sirope de fresa Hacendado,Bote ,"1,45 €"
7799,7799,Fideos de chocolate Hacendado,Paquete ,"1,05 €"
7811,7811,Separador dedos Filarmonica,Paquete ,"1,10 €"
7812,7812,Leche de coco Dee Thai,Bote ,"1,50 €"
7813,7813,Eau de toilette hombre Enrique Iglesias Deeply yours,Frasco ,"8,00 €"
7814,7814,Eau de toilette mujer Enrique Iglesias Deeply yours,Frasco ,"8,00 €"
7816,7816,Espuma rizos definidos Pantene fijación 5,Spray ,"2,95 €"
7834,7834,Pomada del pañal sin perfume Deliplus,Tubo ,"2,90 €"
7836,7836,Renovador del color negro La Nave lava y tiñe,Caja ,"1,80 €"
7839,7839,Wakame ensalada del mar congelada,Paquete ,"1,25 €"
7852,7852,Tiras de potón del Pacífico Hacendado congeladas,Paquete ,"3,50 €"
7859,7859,Infusión fría frutos del bosque Hacendado,Caja ,"1,30 €"
7863,7863,Rodaja de potón del pacífico cocido Hacendado congelado,Paquete ,"4,75 €"
7866,7866,Detergente ropa flores del paraíso Bosque Verde en gel concentrado,Botella ,"3,25 €"
7867,7867,Paté con pimientos del piquillo Hacendado,Tarro ,"1,35 €"
7875,7875,Salchichón ibérico La Hacienda del ibérico lonchas,"2 paquetes x 62,5 g","1,95 €"
7878,7878,Preparado para rebozar Harinera del Mar sin huevo y tempura,Paquete ,"1,45 €"
7882,7882,Vino tinto tempranillo Fin del Río Fariña,Botella ,"1,97 €"
7884,7884,Morcilla ibérica La Hacienda del ibérico,Pieza ,"2,06 €"
7887,7887,Morcón ibérico La Hacienda del ibérico,Pieza ,"12,50 €"
7890,7890,Surtido de ibéricos La Hacienda del ibérico,Paquete ,"5,95 €"
7894,7894,Vino tinto D.O Rioja Herederos del Marqués de Riscal reserva,Botella ,"14,40 €"
7903,7903,Mini salchichón ibérico extra La Hacienda del ibérico,Pieza ,"1,98 €"
7919,7919,Delicias de pollo Hacendado ultracongeladas,Paquete ,"2,90 €"
7921,7921,Delineador de ojos Deliplus 01 negro,1 ud.,"3,50 €"
7922,7922,Espárragos delgados extra Elagón,Tarro ,"0,95 €"
7923,7923,Espárragos delgados Hacendado,Tarro ,"1,19 €"
7924,7924,Lambrusco dell'Emilia rosado espumoso Piccolo Giovanni,Botella ,"1,85 €"
7925,7925,Lambrusco Dell'Emilia rojo espumoso Piccolo Giovanni,Botella ,"1,85 €"
7926,7926,Espárragos delgados verdes enteros Hacendado,Tarro ,"1,45 €"
7927,7927,Multinfusión delgaxan Pompadour,Caja ,"2,25 €"
7928,7928,Desodorante delicado avena Deliplus,Spray ,"1,40 €"
7999,7999,Yogur natural edulcorado Densia 0% materia grasa,4 ud. x 120 g,"1,69 €"
8050,8050,Spray depilatorio Veet for men piel normal,Bote ,"4,40 €"
8080,8080,Desodorante dermo extra control Sanex,Spray ,"2,70 €"
8082,8082,Desodorante dermo invisible Sanex,Spray ,"2,70 €"
8086,8086,Desodorante roll-on dermo extra control Sanex,50 ml,"1,80 €"
8088,8088,Desodorante roll-on dermo sensitive Sanex,50 ml,"1,80 €"
8097,8097,Despigmentante facial con radiance CR dermik Deliplus,Bote ,"5,00 €"
8103,8103,Desodorante roll-on original Dove,50 ml,"1,80 €"
8104,8104,Desodorante fresh & dry para pies Deliplus,Spray ,"1,90 €"
8105,8105,Desodorante original Dove,Spray ,"2,99 €"
8107,8107,Desodorante invisible ice fresh Rexona Men,Spray ,"2,49 €"
8121,8121,Desodorante Lactovit,Spray ,"2,29 €"
8124,8124,Desodorante roll-on natur protect Sanex,50 ml,"2,25 €"
8125,8125,Desodorante roll-on hombre protección plus Deliplus,50 ml,"0,90 €"
8127,8127,Desodorante roll-on invisible black & white Nivea Men,50 ml,"1,95 €"
8131,8131,Desodorante roll-on dry impact Nivea Men,50 ml,"1,95 €"
8136,8136,Desodorante roll-on mujer invisible Deliplus,50 ml,"0,90 €"
8137,8137,Desodorante roll-on Lactovit,50 ml,"1,72 €"
8138,8138,Desodorante original Heno de Pravia,Spray ,"2,70 €"
8143,8143,Desodorante hombre protección plus Deliplus,Spray ,"1,70 €"
8145,8145,Desodorante en crema original Dove,50 ml,"2,25 €"
