,Unnamed: 0,title,quantity,price
1647,1647,Limpiador antical Bosque Verde,Botella ,"1,60 €"
1652,1652,Champú anticaspa H&S clásico,Bote ,"2,99 €"
1655,1655,Champú anticaspa H&S cabello graso,Bote ,"2,99 €"
1658,1658,Recogedor antivuelco con palo Bosque Verde,1 ud.,"1,20 €"
1659,1659,Champú anticaspa H&S menthol fresh,Bote ,"2,99 €"
1660,1660,Spray antiséptico transparente Deliplus,Spray ,"1,90 €"
1663,1663,Limpiador antical Bosque Verde en gel,Botella ,"1,60 €"
1665,1665,Gel anticelulítico efecto frío Deliplus,Bote ,"3,80 €"
1666,1666,Dentífrico anticaries Deliplus con flúor,Tubo ,"0,75 €"
1667,1667,Champú anticaspa Pure Fresh Deliplus cabello normal,Bote ,"1,95 €"
1668,1668,Dentífrico antimanchas intensivo Denivit,Tubo ,"1,99 €"
1669,1669,Champú Anticaída Men Deliplus,Bote ,"1,95 €"
1670,1670,Champú anticaspa Nutritive Deliplus cabello normal,Bote ,"1,95 €"
1671,1671,Mango antideslizante Bosque Verde 140 cm,1 ud.,"1,50 €"
1672,1672,Pipetas anti-insectos para perro Krislin,Paquete ,"4,60 €"
1673,1673,Collar anti-insectos perro Krislin,Caja ,"2,18 €"
1674,1674,Champú anticaspa Cool Fresh Men Deliplus cabello normal,Bote ,"1,95 €"
1675,1675,Crema anticelulítica Deliplus,Bote ,"6,90 €"
1676,1676,Cápsulas antiox colágeno Deliplus,Caja ,"4,95 €"
1677,1677,Pipetas anti-insectos para gato Krislin,Paquete ,"4,60 €"
1678,1678,Collar anti-insectos para gato Krislin,Paquete ,"1,96 €"
1679,1679,Spray anti-insectos para perros y gatos Krislin,Spray ,"3,00 €"
1681,1681,Dentífrico anticaries Deliplus con flúor,Tubo ,"0,50 €"
1683,1683,Multiusos desinfectante antibacterias Bosque Verde,Botella ,"1,95 €"
1686,1686,Body spray citronela Deliplus,Bote ,"1,50 €"
1688,1688,Lavavajillas frescor anti-olor Somat en gel,Botella ,"5,99 €"
1690,1690,Crema facial antiedad revitalizante Sisbela reestructuradora,Tarro ,"5,00 €"
1691,1691,Crema facial antioxidante y regenerante Beauté Mediterranea Dragon's blood,Tarro ,"5,00 €"
1692,1692,Crema corporal anticelulítica Deliplus,Tarro ,"2,30 €"
1693,1693,Crema facial antiarrugas Deliplus pieles maduras FPS 15,Tarro ,"4,50 €"
1694,1694,Crema facial antiedad Deliplus colágeno y silanol,Tarro ,"4,00 €"
1695,1695,Crema facial antiarrugas Deliplus,Bote ,"4,00 €"
1700,1700,Crema corporal antiestrías Deliplus,Caja ,"6,00 €"
1703,1703,Reavivador de ante y nobuk Bosque Verde,Spray ,"3,35 €"
1704,1704,Plantillas gel antideslizantes Bosque Verde,Paquete ,"3,00 €"
1705,1705,Láminas faciales antibrillos Deliplus,Paquete ,"4,00 €"
1706,1706,Crema facial antirrojeces dermik Deliplus,Bote ,"7,00 €"
1709,1709,Lote hombre Antonio Banderas The secret,Caja ,"13,50 €"
1710,1710,Arena para gato antibacterias Nuske,Paquete ,"0,89 €"
1714,1714,Arena para gato antibacterias Nuske perfumada,Paquete ,"1,39 €"
1715,1715,Mostaza a la antigua Hacendado,Tarro ,"1,10 €"
1717,1717,Desodorante sport Deliplus antimanchas,Spray ,"1,70 €"
1719,1719,Tratamiento corporal meso-anticelulítico Deliplus intensivo,Caja ,"8,50 €"
1721,1721,Desodorante gold Deliplus antimanchas,Spray ,"1,70 €"
1722,1722,Desodorante force Deliplus antimanchas,Spray ,"1,70 €"
1723,1723,Stick para pies anti-rozaduras Deliplus,Caja ,"2,50 €"
1724,1724,Desodorante legend Deliplus antimanchas,Spray ,"1,70 €"
1726,1726,Crema de manos anti-manchas Deliplus,Bote ,"1,29 €"
1727,1727,Crema facial noche antiarrugas Q10 plus Nivea,Tarro ,"8,20 €"
1728,1728,Crema facial día antiarrugas Q10 plus Nivea,Tarro ,"8,20 €"
1731,1731,Tratamiento para uñas antimordeduras Deliplus,1 ud.,"2,95 €"
1732,1732,Crema facial día antiarrugas Lift+ Diadermine con hialurón,Tarro ,"9,95 €"
1733,1733,Crema facial día antiarrugas 45+ Garnier,Tarro ,"5,50 €"
1735,1735,Placas para lasaña precocidas Antico Pastificio,Paquete ,"0,95 €"
1737,1737,Desodorante hombre invisible Deliplus antimanchas,Spray ,"1,70 €"
1738,1738,Desodorante mujer invisible Deliplus antimanchas,Spray ,"1,70 €"
1739,1739,Desodorante zero limits Deliplus antimanchas,Spray ,"1,70 €"
1742,1742,Desodorante orient love Deliplus antimanchas,Spray ,"1,70 €"
1743,1743,Eau de toilette hombre Antonio Banderas Blue seduction,Frasco ,"20,50 €"
1744,1744,Eau de toilette hombre Antonio Banderas The golden secret,Frasco ,"18,95 €"
1746,1746,Dentífrico dientes blancos Cosmética Dental antimanchas,Tubo ,"1,95 €"
1747,1747,Crema hidratante para pies Deliplus anti-sequedad,Bote ,"1,60 €"
1748,1748,Crema exfoliante para pies Deliplus anti-durezas,Bote ,"1,90 €"
1749,1749,Desodorante stick cuidado dermo Deliplus antimanchas,50 ml,"1,50 €"
1751,1751,Desodorante roll-on hombre invisible Deliplus antimanchas,50 ml,"0,90 €"
1752,1752,Crema facial hidratante día Revitalift L'Oréal antiarrugas extra firmeza,Tarro ,"9,95 €"
1755,1755,Enjuague bucal dientes blancos Deliplus con extracto de papaya antiplaca,Botella ,"1,49 €"
1763,1763,Champú Vital Theraphy Deliplus cabello apagado y sin vida,Bote ,"2,75 €"
1765,1765,Champú Be Radiant Deliplus cabello apagado,Bote ,"1,95 €"
1769,1769,Aperitivo de encurtidos Hacendado,Tarro ,"1,30 €"
1770,1770,Salsa aperitivo Hacendado,Bote ,"1,05 €"
1771,1771,Combinado de aperitivos Hacendado,Paquete ,"1,20 €"
1772,1772,Snack gato aperitivo líquido Compy,Caja ,"1,59 €"
1773,1773,Cocktail galletitas de aperitivo Hacendado,Bote ,"1,20 €"
1774,1774,Vermouth rojo Maronti reserva,Botella ,"3,29 €"
1775,1775,Vermouth rojo Maronti,Botella ,"2,05 €"
1776,1776,Vermouth rosso Martini,Botella ,"7,99 €"
1777,1777,Vermouth bianco Martini,Botella ,"7,99 €"
1778,1778,Vermouth blanco Maronti,Botella ,"2,05 €"
1779,1779,Apio verde,Paquete ,"1,42 €"
1780,1780,Apio en tiras Hacendado,Tarro ,"0,75 €"
1781,1781,Tampones super Deliplus con aplicador clásico,Caja ,"2,70 €"
1782,1782,Tampones super Deliplus con aplicador suave,Caja ,"2,40 €"
1783,1783,Tampones regular Deliplus con aplicador clásico,Caja ,"2,70 €"
1784,1784,Tampones regular Deliplus con aplicador suave,Caja ,"2,40 €"
1785,1785,Tampones regular Deliplus sin aplicador,Caja ,"2,50 €"
1786,1786,Tampones super Deliplus sin aplicador,Caja ,"2,50 €"
1787,1787,Tampones mini Deliplus con aplicador suave,Caja ,"2,40 €"
1788,1788,Tampones mini Deliplus sin aplicador,Caja ,"2,50 €"
1789,1789,Tampones super plus Deliplus con aplicador clásico,Caja ,"2,70 €"
1790,1790,Tampones super plus Deliplus con aplicador suave,Caja ,"2,40 €"
1793,1793,Apresto Zelco instantáneo,Spray ,"1,65 €"
1794,1794,Crema depilatoria facial apta para piel sensible,Tubo ,"1,50 €"
1795,1795,Cera caliente en tarro apta piel sensible,Caja ,"3,50 €"
1796,1796,Bebida isotónica limón Aquarius zero azúcar,Botella ,"1,55 €"
1797,1797,Bebida isotónica limón Aquarius,Botella ,"1,55 €"
1798,1798,Bebida isotónica naranja Aquarius,Botella ,"1,55 €"
1799,1799,Bebida isotónica limón Aquarius,Lata ,"0,70 €"
1800,1800,Bebida isotónica naranja Aquarius,Lata ,"0,70 €"
1801,1801,Bebida isotónica limón Aquarius,8 latas x 330 ml,"5,36 €"
1802,1802,Bebida isotónica de naranja Iso drink,Botella ,"0,92 €"
1803,1803,Bebida isotónica naranja Aquarius,8 latas x 330 ml,"5,36 €"
1804,1804,Bebida isotónica blue Iso drink,Botella ,"0,47 €"
1805,1805,Bebida isotónica azul Powerade,Botella ,"1,10 €"
1806,1806,Bebida isotónica blue Iso drink,Botella ,"1,18 €"
1807,1807,Bebida isotónica de naranja Iso drink,6 latas x 330 ml,"1,74 €"
1808,1808,Bebida isotónica de naranja Iso drink,Lata ,"0,32 €"
1811,1811,Gel de baño aqua marina Deliplus piel normal,Botella ,"1,35 €"
1814,1814,Gel crema corporal hidratante aqua Deliplus,Tarro ,"2,20 €"
1815,1815,Tiras protectoras de poliuretano surtidas Doctor San especial aqua,Caja ,"0,90 €"
1816,1816,Arándanos enteros Hacendado ultracongelados,Paquete ,"1,79 €"
1817,1817,Arándanos deshidratados Hacendado,Paquete ,"2,00 €"
1819,1819,Cheesecake con arándanos Hacendado,2 ud. x 95 g,"1,50 €"
1820,1820,Mermelada de arándano Helios,Tarro ,"1,55 €"
1822,1822,Preparado en polvo gelatina arándano Hacendado 0% azúcar,Caja ,"1,19 €"
1824,1824,Postre lácteo + proteínas Hacendado con arándanos,4 ud. x 120 g,"1,40 €"
1825,1825,Chocolate extrafino negro Hacendado con arándanos y sésamo,Tableta ,"1,25 €"
1826,1826,Barritas de cereales Hacendado con arándanos,Caja ,"1,35 €"
1827,1827,Paté de cerdo y pollo con trufa y arándanos Hacendado,Paquete ,"1,60 €"
1828,1828,Arroz arborio especial risotto Hacendado,Paquete ,"2,16 €"
1830,1830,Mascarilla facial peeling árbol de té Montagne Jeunesse,2 ud. x 8 ml,"1,50 €"
1832,1832,Arcos dentales para higiene interdental,Caja ,"1,80 €"
1833,1833,Café en cápsula ristretto ardenza Dolce Gusto,Caja ,"4,25 €"
1838,1838,Lecho vegetal para pequeñas mascotas Nuske,Saco ,"4,50 €"
1839,1839,Hidratante facial BB cream Deliplus tono arena clara FPS 30,Bote ,"3,50 €"
1840,1840,Polvo compacto balm me Deliplus 01 arena,1 ud.,"6,00 €"
1842,1842,Champú Argan Oil Deliplus cabello seco y dañado,Bote ,"1,95 €"
1843,1843,Salsa estilo argentino Hacendado,Tarro ,"1,20 €"
1844,1844,Empanadilla de carne Argentina,Pieza ,"0,75 €"
1845,1845,Filetes de merluza Argentina sin piel Hacendado ultracongelados,Paquete ,"5,95 €"
1846,1846,Gel de baño argán Deliplus piel muy seca,Botella ,"1,40 €"
1849,1849,Paté de cerdo Argal,3 latas x 83 g,"1,55 €"
1850,1850,Paté de cerdo light Argal,3 latas x 80 g,"1,30 €"
1851,1851,Paté de cerdo sabor suave Argal,6 latas x 83 g,"1,61 €"
1853,1853,Aritos de surimi a la romana Pescanova ultracongelados,Paquete ,"2,19 €"
1856,1856,Neceser Ariel mediano con asas,1 ud.,"6,50 €"
1857,1857,Detergente ropa Ariel original líquido,Botella ,"6,95 €"
1858,1858,Detergente ropa Ariel en polvo,Caja ,"6,99 €"
1859,1859,Queso fresco Burgo de Arias,3 tarrinas x 72 g,"2,19 €"
1860,1860,Queso fresco Burgo de Arias 0% materia grasa,3 tarrinas x 72 g,"2,19 €"
1862,1862,Tortiglioni Armando,Paquete ,"0,95 €"
1863,1863,Fusilli Armando,Paquete ,"0,95 €"
1864,1864,Penne Armando,Paquete ,"0,95 €"
1865,1865,Spaghetti Armando,Caja ,"0,95 €"
1868,1868,Vino tinto selección Armónico,Botella ,"1,90 €"
1869,1869,Vino tinto gran selección Armónico,Botella ,"2,19 €"
1870,1870,Stick de árnica cata pum Deliplus,Caja ,"4,25 €"
1871,1871,Aros de cebolla rebozados Hacendado ultracongelados,Paquete ,"1,75 €"
1872,1872,Aroma de vainilla Hacendado,Bote ,"2,10 €"
1876,1876,Arroz basmati aromático Hacendado,Paquete ,"2,10 €"
1877,1877,Arroz Jazmín aromático Hacendado,Paquete ,"1,90 €"
1881,1881,Manteca corporal con aroma de coco Deliplus,Tarro ,"4,00 €"
1885,1885,Café molido mezcla Marcilla gran aroma,Caja ,"2,55 €"
1886,1886,Café molido natural Marcilla gran aroma,Caja ,"2,55 €"
1888,1888,Snack perro galletas Compy con aroma de vainilla,Paquete ,"2,39 €"
1889,1889,Preservativos fun On colores y aromas,Caja ,"2,00 €"
1890,1890,Snack perro mix galletas Compy con aroma de vainilla,Paquete ,"0,87 €"
1891,1891,Cilantro,Bandeja ,"1,15 €"
1892,1892,Jengibre,200 g aprox.,"0,96 €"
1893,1893,Perejil troceado,Paquete ,"0,70 €"
1894,1894,Hierbabuena,Paquete ,"1,15 €"
1895,1895,Cebollino,Bandeja ,"1,15 €"
1896,1896,Arroz redondo Hacendado,Paquete ,"0,79 €"
1897,1897,Arroz largo Hacendado,Paquete ,"0,83 €"
1898,1898,Arroz cocido basmati Brillante,2 vasitos x 125 g,"1,15 €"
1899,1899,Arroz bomba Hacendado,Paquete ,"2,65 €"
1900,1900,"Arreglo para puchero vacuno, cerdo y pollo",Bandeja ,"4,60 €"
1901,1901,Arroz cocido integral Brillante,2 vasitos x 125 g,"1,10 €"
1902,1902,Arroz cocido redondo Hacendado,2 vasitos x 125 g,"0,99 €"
1904,1904,Arroz tres delicias Hacendado ultracongelado,Paquete ,"2,32 €"
1905,1905,Arroz Nomen,Paquete ,"1,42 €"
1906,1906,Arroz integral redondo Hacendado,Paquete ,"1,49 €"
1907,1907,Arroz redondo J Sendra Hacendado,Paquete ,"1,00 €"
1908,1908,Arroz con leche Hacendado,4 ud. x 115 g,"0,97 €"
1909,1909,Arroz precocido Hacendado ultracongelado,Paquete ,"1,65 €"
1910,1910,Arroz vaporizado Hacendado,Paquete ,"1,15 €"
1911,1911,Arroz negro Hacendado ultracongelado,Paquete ,"2,15 €"
1913,1913,Arroz redondo Brillante,Paquete ,"1,62 €"
1914,1914,Arroz con leche Hacendado,Tarrina ,"1,20 €"
1915,1915,Arroz con verduras Hacendado ultracongelado,Paquete ,"0,95 €"
1916,1916,Arreglo para paella de marisco,Bandeja ,"8,00 €"
1917,1917,Arroz con pollo asado Hacendado ultracongelado,Paquete ,"1,75 €"
1919,1919,Arroz especial ensaladas y guarnición Hacendado,Paquete ,"2,19 €"
1920,1920,Arroz marinera Hacendado ultracongelado,Paquete ,"1,99 €"
1921,1921,Arreglo para escudella,Bandeja ,"6,25 €"
1922,1922,Papilla arroz con pollo Hero baby natur +6 meses,Tarrito ,"0,99 €"
1926,1926,Tortitas de arroz con chocolate blanco sabor yogur Hacendado,Paquete ,"1,30 €"
1927,1927,Tortitas de arroz Hacendado,Paquete ,"1,05 €"
1929,1929,Tortitas de arroz con chocolate Hacendado,Paquete ,"1,55 €"
1930,1930,Tortitas de arroz con chocolate con leche Hacendado,Paquete ,"1,55 €"
1931,1931,Bebida de arroz y coco Hacendado,Brick ,"1,60 €"
1932,1932,Morcilla de arroz y cebolla,Bandeja ,"1,34 €"
1933,1933,Cereales de arroz inflado Choco Krispies Kellogg's,Caja ,"2,99 €"
1936,1936,Cereales de arroz inflado con chocolate Hacendado,Caja ,"1,75 €"
1937,1937,Harina de arroz Hacendado,Paquete ,"0,95 €"
1938,1938,Bebida de arroz y coco Hacendado,6 bricks x 1 L,"9,60 €"
1939,1939,Sémola de arroz Hacendado,Paquete ,"0,85 €"
1940,1940,Noodles de arroz Hacendado sabor vegetal,Bol ,"1,30 €"
1941,1941,Papilla zanahorias con arroz en caldito de pollo Hero baby +6 meses,Tarrito ,"0,99 €"
1942,1942,Licor crema de arroz Royal Swan,Botella ,"6,00 €"
1944,1944,Tortitas de avena y arroz Selecta,Paquete ,"1,35 €"
1945,1945,"Copos de trigo integral, arroz y cebada integral tostados con chocolate Hacendado",Caja ,"1,99 €"
1947,1947,Vino blanco D.O. Rueda Arribeño sauvignon blanc,Botella ,"3,00 €"
1948,1948,"Copos de trigo integral, arroz y cebada integral tostados con frutos rojos Hacendado",Caja ,"1,50 €"
1949,1949,Salmón al curry con arroz,Bandeja ,"3,50 €"
1950,1950,"Copos de trigo integral, arroz y cebada integral tostados Hacendado",Caja ,"1,59 €"
1952,1952,Vino blanco verdejo D.O Rueda Arribeño,Botella ,"2,20 €"
1953,1953,Copos de trigo integral y arroz Special K classic,Caja ,"2,99 €"
1955,1955,Copos de trigo integral y arroz Special K dark chocolate,Caja ,"2,65 €"
1956,1956,Copos de trigo integral y arroz bañados en chocolate con leche Hacendado,Caja ,"1,79 €"
1957,1957,Pollo al curry Hacendado con arroz basmati,Bandeja ,"2,50 €"
1960,1960,Papilla sin gluten crema de arroz Hero baby +4 meses,Caja ,"1,99 €"
1961,1961,Lasaña sin gluten de maíz y arroz Felicia,Caja ,"2,35 €"
1965,1965,Comida cachorros junior Compy con pollo y arroz,Paquete ,"5,00 €"
1966,1966,Comida perro júnior Compy con pollo y arroz,Saco ,"11,95 €"
1972,1972,Comida gato sénior Supreme Compy con pollo y arroz,Paquete ,"4,55 €"
1975,1975,Comida perro júnior Supreme Compy con pollo y arroz,Paquete ,"7,45 €"
1976,1976,Comida perro júnior Supreme Compy con pollo y arroz,Paquete ,"4,15 €"
1986,1986,Quinoa cocida blanca y roja Hacendado,2 vasitos x 125 g,"1,35 €"
1987,1987,Hueso garrón Incarlopsa,290 g aprox.,"0,87 €"
1988,1988,Pelota de cerdo,Bandeja ,"1,35 €"
1989,1989,Quinoa Hacendado,Paquete ,"2,79 €"
1990,1990,Hueso vacuno,Bandeja ,"0,73 €"
1991,1991,Trozo de vacuno para cocido,Bandeja ,"2,37 €"
1992,1992,Cous cous mediano Bia,Caja ,"1,55 €"
1993,1993,Compango asturiano,Paquete ,"2,35 €"
1994,1994,Patas de cerdo,Bandeja ,"2,00 €"
1995,1995,Risotto de champiñones Hacendado ultracongelados,Paquete ,"1,25 €"
1996,1996,Osobuco de cerdo,Bandeja ,"0,74 €"
1997,1997,Costilla de vacuno,Bandeja ,"1,35 €"
1998,1998,Quinoa con verduras Hacendado ultracongelada,Paquete ,"1,65 €"
1999,1999,Chorizo asturiano,Paquete ,"2,25 €"
2000,2000,Espinazo de cerdo,Bandeja ,"0,72 €"
2001,2001,Risotto de setas Hacendado,Bandeja ,"2,50 €"
2002,2002,Tocino de cerdo,Bandeja ,"0,49 €"
2003,2003,Media gallina,Bandeja ,"1,51 €"
2004,2004,Hueso blanco de cerdo salado,Bandeja ,"1,89 €"
2005,2005,Pelota de cerdo y vacuno,Bandeja ,"2,01 €"
2006,2006,Preparado de cerdo salado,Bandeja ,"1,93 €"
2007,2007,Canelones de carne con bechamel Hacendado ultracongelados,Caja ,"2,20 €"
2008,2008,Canelones de carne con bechamel Hacendado ultracongelados,Caja ,"3,99 €"
2009,2009,Lasaña a la boloñesa Hacendado ultracongelada,Caja ,"2,20 €"
2010,2010,Canelones de atún con bechamel Hacendado ultracongelados,Caja ,"2,10 €"
2011,2011,Gnocchi de pollo y verduras Hacendado ultracongelados,Paquete ,"2,38 €"
2012,2012,Canelones de carne sin bechamel Hacendado ultracongelados,Paquete ,"1,80 €"
2013,2013,Lasaña de verduras Hacendado ultracongelada,Caja ,"2,05 €"
2014,2014,Lasaña de carne a la barbacoa Hacendado ultracongelada,Caja ,"2,13 €"
2015,2015,Lasaña a la boloñesa Hacendado ultracongelada,Caja ,"4,00 €"
2016,2016,Barquillos rellenos de chocolate Hacendado,Paquete ,"0,70 €"
2017,2017,Barquillos rellenos sabor nata Hacendado,Paquete ,"0,70 €"
2019,2019,Artesanitos,Bolsa ,"1,48 €"
2020,2020,Barquillos mini rolls bañados con chocolate con leche Hacendado,Paquete ,"1,20 €"
2021,2021,Cerveza artesana premium lager Santa Rita,Botellín ,"1,22 €"
2022,2022,Cerveza IPA artesana Tibidabo,Lata ,"1,49 €"
2023,2023,Tomate frito receta artesana Hacendado,Tarro ,"1,70 €"
2024,2024,Tomate frito receta artesana Hacendado,Tarro ,"1,28 €"
2025,2025,Bases de pizza artesanas extrafinas y crujientes Hacendado ultracongeladas,Paquete ,"1,75 €"
2026,2026,Surtido de pastas artesanas Hacendado,Caja ,"1,85 €"
2027,2027,Cápsulas huesos y articulaciones Deliplus,Caja ,"3,95 €"
2028,2028,Surtido de galletas y barquillos Hacendado,Paquete ,"1,15 €"
2029,2029,Vino tinto D.O Rioja Arteso crianza,Botella ,"4,50 €"
2030,2030,Vino rosado D.O Rioja Arteso clarete,Botella ,"3,25 €"
2031,2031,Vino tinto D.O Rioja Arteso reserva,Botella ,"7,00 €"
2032,2032,Vino blanco D.O Rioja Arteso,Botella ,"3,00 €"
2033,2033,Obleas para helados Hacendado,Paquete ,"0,40 €"
2034,2034,"Barra de helado sabor vainilla, chocolate y nata Hacendado",Caja ,"0,99 €"
2035,2035,Tarta helada nata y chocolate Hacendado,Caja ,"1,75 €"
2036,2036,Barra de helado turrón Hacendado,Caja ,"1,99 €"
2037,2037,Cono de barquillo Hacendado,Caja ,"1,45 €"
2038,2038,Tubitos bañados chocolate negro Hacendado,Bote ,"1,70 €"
2039,2039,Tubitos Hacendado,Bote ,"1,53 €"
2040,2040,Tulipas bañadas Dicar,Caja ,"2,35 €"
2041,2041,Queso Arzúa-Ulloa Punteiro,Pieza ,"5,88 €"
2042,2042,Cepillo para lavar con asa Bosque Verde,1 ud.,"1,20 €"
2043,2043,Neceser Frozen mediano con asas,1 ud.,"6,50 €"
2045,2045,Neceser Mulán grande con asas,1 ud.,"7,50 €"
2046,2046,Neceser dinosaurio grande con asas,1 ud.,"6,50 €"
2047,2047,Neceser Minnie grande con asas,1 ud.,"7,50 €"
2048,2048,Neceser pingüino grande con asas,1 ud.,"6,50 €"
2049,2049,Neceser Poopsie mediano con asas,1 ud.,"6,50 €"
2050,2050,Neceser oso rosa grande con asa,1 ud.,"6,50 €"
2051,2051,Pollo asado Platos Tradicionales,Paquete ,"3,99 €"
2052,2052,Pimientos asados en tiras Hacendado,Bandeja ,"1,98 €"
2053,2053,Pollo asado troceado Platos Tradicionales,Paquete ,"4,65 €"
2054,2054,"Pollo asado Tradigust relleno con jamón, queso y huevo",Paquete ,"7,30 €"
2055,2055,"Pollo asado Tradigust relleno con ciruelas, pasas y nueces",Paquete ,"7,30 €"
2056,2056,Pimientos rojos asados Hacendado en tiras extra,3 latas x 60 g,"0,97 €"
2057,2057,Pollo relleno asado al horno La Carloteña lonchas,Paquete ,"1,89 €"
2058,2058,Bolsas para asar Bosque Verde,Paquete ,"1,65 €"
2059,2059,Sazonador pollo asado Hacendado,Bote ,"1,05 €"
2060,2060,Salteado de verduras asadas Hacendado ultracongeladas,Paquete ,"1,50 €"
2062,2062,Codillo de cerdo asado Hacendado,Paquete ,"6,20 €"
2064,2064,Pies de cerdo asados Noel,Paquete ,"4,77 €"
2066,2066,Hummus de garbanzos Hacendado con pimiento del piquillo asado,Tarrina ,"1,60 €"
2070,2070,Bolsas para residuos caninos Kordis Doggy bags,Paquete ,"1,30 €"
2071,2071,Stick dental para perro Compy con menta,Paquete ,"1,47 €"
2073,2073,Ministick dental para perro Compy,Paquete ,"1,98 €"
2074,2074,Hueso dental para perro Compy,Paquete ,"1,65 €"
2075,2075,Huesos de cuero para perro Compy,Paquete ,"1,28 €"
2077,2077,Hierba para gatos Natura,Caja ,"2,70 €"
2080,2080,Malta para gato Natura con queso,Tubo ,"3,50 €"
2086,2086,Wok de verduras asiático Paissano ultracongelado,Paquete ,"2,45 €"
2088,2088,Edulcorante granulado aspartamo Hacendado,Bote ,"1,65 €"
2090,2090,Edulcorante en pastillas aspartamo Hacendado,Bote ,"1,75 €"
2091,2091,Gel de baño 10% urea Deliplus piel áspera y deshidratada,Botella ,"2,00 €"
2093,2093,Fabada asturiana Litoral,Bote ,"1,85 €"
2095,2095,Sidra asturiana El Mayu,4 botellines x 250 ml,"1,85 €"
2096,2096,Sidra asturiana El Mayu,Botella ,"0,99 €"
2097,2097,Leche semidesnatada Asturiana,"6 botellas x 1,5 L","7,50 €"
2098,2098,Leche entera Asturiana,"6 botellas x 1,5 L","7,50 €"
2099,2099,Leche semidesnatada Asturiana,Botella ,"1,25 €"
2100,2100,Leche entera Asturiana,Botella ,"1,25 €"
2101,2101,Hojaldre de Astorga Dulma,40 g aprox.,"0,15 €"
2102,2102,Eau de toilette mujer Como tú Astucia,Frasco ,"7,00 €"
2104,2104,Contorno de ojos atenúa bolsas y ojeras Deliplus,Tubo ,"1,95 €"
2107,2107,"Loción corporal pieles atópicas Deliplus con omegas 3,6 y 9",Bote ,"2,20 €"
2108,2108,Bálsamo corporal infantil pieles atópicas Deliplus,Bote ,"4,30 €"
2109,2109,Bálsamo facial infantil pieles atópicas Deliplus,Bote ,"3,20 €"
2110,2110,Toallitas bebé pieles con tendencia atópica Deliplus,Paquete ,"1,60 €"
2111,2111,Gel - champú bebé para pieles atópicas Deliplus,Bote ,"3,70 €"
2112,2112,Toallitas bebé pieles con tendencia atópica Deliplus,Paquete ,"0,95 €"
2114,2114,Gamuzas atrapa polvo Bosque Verde,Paquete ,"1,95 €"
2115,2115,Plumero atrapa polvo Zeppilin electroestático,Paquete ,"2,59 €"
2116,2116,Plumero atrapa polvo Bosque Verde,1 ud.,"1,60 €"
2117,2117,Mopa atrapa polvo Bosque Verde multiusos,Paquete ,"3,30 €"
2118,2118,Sombra de ojos sedosa Attraction Deliplus 04 azul marino,1 ud.,"3,65 €"
2121,2121,Atún claro al natural Hacendado,6 latas x 60 g,"3,50 €"
2128,2128,Atún claro bajo en sal Hacendado en aceite de oliva,3 latas x 60 g,"2,28 €"
2129,2129,Atún claro en escabeche blanco Hacendado,6 latas (480 g),"3,90 €"
2131,2131,Atún en salsa de tomate Hacendado,3 latas x 52 g,"1,70 €"
2132,2132,Pizza atún y bacón Hacendado,415 g,"2,39 €"
2133,2133,Pizza atún Hacendado ultracongelada,390 g,"2,00 €"
2134,2134,Pizza atún y bacón Hacendado,2 ud. x 220 g,"2,35 €"
2136,2136,Ventresca de atún claro Hacendado en aceite de oliva,Lata ,"2,15 €"
2137,2137,Filete de atún,Bandeja ,"7,28 €"
2138,2138,Empanadillas de atún Hacendado ultracongeladas,Caja ,"1,60 €"
2140,2140,Pastel de atún Hacendado,Bandeja ,"2,80 €"
2141,2141,Paté de atún Hacendado,3 tarros x 125 g,"2,40 €"
2142,2142,Empanada rellena de atún,Pieza ,"3,50 €"
2143,2143,Mini empanadillas de atún Hacendado ultracongeladas,Caja ,"1,70 €"
2144,2144,Empanada rellena de atún,Pieza ,"6,25 €"
2145,2145,Pizza masa fina atún Hacendado ultracongelada,400 g,"2,29 €"
2150,2150,Filetes de caballa del sur en aceite de oliva Hacendado,2 latas x 65 g,"1,60 €"
2152,2152,Salmón al natural Hacendado,3 latas x 50 g,"2,65 €"
2153,2153,Trozos de bonito del norte Hacendado en aceite de oliva,3 latas x 52 g,"1,95 €"
2156,2156,Calamar en tinta Hacendado,3 latas x 59 g,"1,69 €"
2157,2157,Sardinillas reducidas en sal Hacendado en aceite de oliva,2 latas x 65 g,"1,38 €"
2158,2158,Filetes de bonito del norte en aceite de oliva Hacendado,Tarro ,"6,00 €"
2159,2159,Sardinas en salsa de tomate Hacendado,2 latas x 82 g,"1,10 €"
2163,2163,Sardinillas picantes Hacendado en aceite de girasol,2 latas x 65 g,"1,24 €"
2164,2164,Chipirones rellenos enteros Hacendado en aceite de girasol,Lata ,"1,95 €"
2165,2165,Filetes de caballa del sur en aceite de girasol Hacendado,2 latas x 65 g,"1,39 €"
2166,2166,Bonito del norte en escabeche Hacendado,Lata ,"3,00 €"
2167,2167,Sardinillas en escabeche Hacendado,2 latas x 65 g,"1,27 €"
2168,2168,Sardinillas al limón Hacendado en aceite de girasol,2 latas x 65 g,"1,21 €"
2169,2169,Filetes de caballa del sur bajo contenido en sal Hacendado en aceite de oliva,2 latas x 65 g,"1,90 €"
2170,2170,Sardinillas picantonas Hacendado,Lata ,"1,00 €"
2171,2171,Filetes de caballa del sur en escabeche Hacendado,2 latas x 65 g,"1,58 €"
2174,2174,Sardinillas en tomate Hacendado,2 latas x 65 g,"1,14 €"
2175,2175,Filetes de caballa del sur en tomate Hacendado,2 latas x 65 g,"1,40 €"
2177,2177,Sardinas en salsa de escabeche Hacendado,2 latas x 82 g,"1,20 €"
2180,2180,Trozos de sepia en tinta Hacendado,Lata ,"1,88 €"
2181,2181,Filetes de melva en aceite de girasol Hacendado,2 latas x 65 g,"2,36 €"
2182,2182,Filetes de melva canutera con pimientos del piquillo Marinara en aceite de oliva,Lata ,"1,62 €"
2184,2184,Tacos de pota a la marinera Hacendado,3 latas x 54 g,"2,30 €"
2185,2185,Huevas de bacalao Hacendado,Tarrina ,"1,55 €"
2186,2186,Carne de cangrejo al natural Chatka,Lata ,"5,50 €"
2199,2199,Betún negro autobrillante Búfalo,Tarro ,"2,65 €"
2200,2200,Betún incoloro autobrillante Búfalo,Tarro ,"2,65 €"
2202,2202,Betún marrón autobrillante Búfalo,Tarro ,"2,65 €"
2203,2203,Betún azul autobrillante Búfalo,Tarro ,"2,65 €"
2204,2204,Dentífrico blanqueador avanzado Licor del Polo 2 en 1,Bote ,"2,10 €"
