,Unnamed: 0,title,quantity,price
4091,4091,Brillo de labios Hot Metal Deliplus 02,1 ud.,"3,50 €"
4092,4092,Brillo de labios Galactic metal Deliplus 01 vino,1 ud.,"3,50 €"
4093,4093,Brillo de labios Galactic metal Deliplus 03 cobre,1 ud.,"3,50 €"
4094,4094,Queso brie marcillat Plaisir de Roy,Pieza ,"1,10 €"
4095,4095,Limpiahogar brillo Bosque Verde,Botella ,"2,15 €"
4096,4096,Cera brillante fuerza 1 Deliplus para todo tipo de cabellos,Tarro ,"2,65 €"
4098,4098,Spray cabello brillo todo tipo de cabello Deliplus sin fijación,Spray ,"1,75 €"
4101,4101,Masa fresca quebrada brisa Hacendado,2 paquetes x 230 g,"2,38 €"
4102,4102,Champú protección y brillo Deliplus todo tipo de cabello,Botella ,"0,90 €"
4105,4105,Chorizo de Tarancón Bricio,1 ud.,"2,90 €"
4107,4107,Laca cabello extra brillo todo tipo de cabello Deliplus fijación 3,Spray ,"2,30 €"
4110,4110,Tratamiento para uñas gel brillo Deliplus secado rápido,1 ud.,"2,95 €"
4117,4117,Esponja de calzado incoloro brillo Bosque Verde,1 ud.,"0,60 €"
4132,4132,Pintalabios cremoso Deliplus 11,1 ud.,"4,50 €"
4133,4133,Pintalabios cremoso Deliplus 14,1 ud.,"4,50 €"
4134,4134,Pintalabios cremoso Deliplus 06,1 ud.,"4,50 €"
4135,4135,Pintalabios cremoso Deliplus 10,1 ud.,"4,50 €"
4136,4136,Pintalabios cremoso Deliplus 04,1 ud.,"4,50 €"
4137,4137,Pintalabios cremoso Deliplus 03,1 ud.,"4,50 €"
4138,4138,Pintalabios cremoso Deliplus 02,1 ud.,"4,50 €"
4139,4139,Pintalabios cremoso Deliplus 19,1 ud.,"4,50 €"
4140,4140,Pintalabios cremoso Deliplus 15,1 ud.,"4,50 €"
4141,4141,Pintalabios cremoso Deliplus 12,1 ud.,"4,50 €"
4142,4142,Pintalabios cremoso Deliplus 05,1 ud.,"4,50 €"
4143,4143,Pintalabios cremoso Deliplus 01,1 ud.,"4,50 €"
4144,4144,Pintalabios Pearl 02 burdeos Deliplus My Soul,1 ud.,"5,50 €"
4145,4145,Pintalabios cremoso Deliplus 17,1 ud.,"4,50 €"
4146,4146,Pintalabios cremoso Deliplus 08,1 ud.,"4,50 €"
4147,4147,Pintalabios cremoso Deliplus 07,1 ud.,"4,50 €"
4148,4148,Pintalabios cremoso Deliplus 13,1 ud.,"4,50 €"
4149,4149,Pintalabios cremoso Deliplus 09,1 ud.,"4,50 €"
4150,4150,Zumo pura naranja Hacendado,Brick ,"1,00 €"
4151,4151,Horchata de chufa Hacendado,Brick ,"1,10 €"
4152,4152,Zumo pura naranja con pulpa Hacendado,Brick ,"1,00 €"
4154,4154,Tomate frito estilo casero Hacendado,Brick ,"0,93 €"
4156,4156,Leche semidesnatada Hacendado,Brick ,"0,58 €"
4158,4158,Fritada pisto Hacendado,Brick ,"0,95 €"
4160,4160,Nata para montar Hacendado,Brick ,"1,05 €"
4161,4161,Zumo de manzana Hacendado,Brick ,"0,59 €"
4162,4162,Leche entera Hacendado,Brick ,"0,59 €"
4164,4164,Leche semidesnatada sin lactosa Hacendado,Brick ,"0,75 €"
4165,4165,Leche entera Hacendado fresca,Brick ,"0,80 €"
4166,4166,Leche evaporada Hacendado,Brick ,"0,85 €"
4167,4167,Leche desnatada sin lactosa Hacendado,Brick ,"0,74 €"
4168,4168,Nata ligera para cocinar Hacendado,Brick ,"1,05 €"
4169,4169,Salmorejo al estilo cordobés Hacendado,Brick ,"1,65 €"
4170,4170,Leche desnatada Hacendado,Brick ,"0,57 €"
4171,4171,Zumo de melocotón y uva Hacendado,Brick ,"0,58 €"
4172,4172,Zumo de naranja selección Hacendado,Brick ,"1,30 €"
4173,4173,Zumo de piña y uva Hacendado,Brick ,"0,58 €"
4175,4175,Zumo de naranja Hacendado,Brick ,"0,70 €"
4176,4176,Tomate frito con cebolla Hacendado,Brick ,"1,05 €"
4178,4178,Crema de calabaza Hacendado,Brick ,"1,00 €"
4179,4179,Zumo de piña selección Hacendado,Brick ,"1,59 €"
4180,4180,Leche semidesnatada Hacendado fresca,Brick ,"0,79 €"
4181,4181,Zumo de piña Hacendado,Brick ,"0,75 €"
4183,4183,"Néctar de maracuyá Hacendado fruta de la pasión, mango, uva y manzana",Brick ,"0,79 €"
4185,4185,Crema de verduras Hacendado,Brick ,"1,00 €"
4187,4187,Zumo de tomate Hacendado,Brick ,"0,65 €"
4192,4192,Leche entera Pascual,Brick ,"0,89 €"
4196,4196,Leche entera sin lactosa Hacendado,Brick ,"0,76 €"
4197,4197,Crema de pollo Hacendado con verduras,Brick ,"1,00 €"
4198,4198,Fruta + leche tropical Hacendado,Brick ,"0,73 €"
4199,4199,Vino tinto Casón Histórico,Brick ,"0,95 €"
4200,4200,Zumo de manzana selección Hacendado,Brick ,"1,36 €"
4201,4201,Tomate tamizado sin piel Hacendado,Brick ,"0,70 €"
4202,4202,Leche desnatada Pascual,Brick ,"0,89 €"
4203,4203,Brócoli,Pieza ,"1,33 €"
4205,4205,Brócoli Hacendado,Paquete ,"1,49 €"
4207,4207,Brotes germinados Hacendado,Tarro ,"1,18 €"
4208,4208,Brochetas de madera,Paquete ,"1,00 €"
4209,4209,Brocha maquillaje Deliplus,1 ud.,"5,25 €"
4210,4210,Brocha polvos Deliplus,1 ud.,"6,00 €"
4214,4214,"Coliflor, brócoli y zanahoria Hacendado ultracongelada",Paquete ,"1,85 €"
4217,4217,Ensalada mezcla brotes tiernos,Paquete ,"0,99 €"
4219,4219,Ensalada mezcla brotes tiernos maxi,Paquete ,"1,70 €"
4226,4226,Whisky escocés Brodick's,Botella ,"6,50 €"
4227,4227,Loción corporal efecto bronceado Deliplus,Bote ,"2,75 €"
4229,4229,Lasaña de salmón y brócoli Hacendado,Bandeja ,"3,50 €"
4234,4234,Esponja maquillaje triángulos Deliplus,4 ud.,"2,25 €"
4235,4235,Esponja maquillaje Deliplus,1 ud.,"3,90 €"
4236,4236,Sacapuntas doble Deliplus lápiz fino y grueso,1 ud.,"2,50 €"
4237,4237,Pincel polvos Deliplus,1 ud.,"6,00 €"
4238,4238,Pincel pestañas y cejas Deliplus,1 ud.,"4,00 €"
4239,4239,Pincel colorete Deliplus,1 ud.,"6,00 €"
4240,4240,Pincel sombra Deliplus,1 ud.,"5,00 €"
4241,4241,Pincel labios Deliplus,1 ud.,"4,00 €"
4242,4242,Pincel difuminador Deliplus,1 ud.,"5,00 €"
4243,4243,Pincel sombra pony Deliplus,1 ud.,"5,00 €"
4244,4244,Pincel delineador Deliplus,1 ud.,"5,00 €"
4245,4245,Pincel maquillaje Deliplus,1 ud.,"6,00 €"
4246,4246,Pincel mofeta Deliplus,1 ud.,"6,00 €"
4247,4247,Cava brut Cabré & Sabaté,Botella ,"1,95 €"
4248,4248,Cava brut nature Jaume Serra,Botella ,"3,25 €"
4249,4249,Cava brut rosado Cabré & Sabaté,Botella ,"2,29 €"
4250,4250,Cava brut nature vintage Cabré & Sabaté,Botella ,"3,75 €"
4251,4251,Cava brut Cabré & Sabaté,4 benjamines x 200 ml,"4,35 €"
4252,4252,Cava brut nature Juvé & Camps,Botella ,"16,25 €"
4256,4256,Cava brut nature Jaume Serra reserva,Botella ,"3,75 €"
4257,4257,Cava brut Cabré & Sabaté Chardonnay,Botella ,"3,75 €"
4258,4258,Cava brut nature Freixenet reserva,Botella ,"8,50 €"
4259,4259,Cava brut Freixenet,Botella ,"5,40 €"
4260,4260,Cava brut nature Raimat,Botella ,"8,95 €"
4262,4262,Coles de Bruselas Hacendado ultracongeladas,Paquete ,"0,79 €"
4264,4264,Lote hombre Brummel,Caja ,"9,30 €"
4265,4265,Copos de avena Brüggen,Caja ,"0,77 €"
4266,4266,Limpiador Las 3 Brujas concentrado,Botella ,"2,82 €"
4268,4268,Eau de cologne hombre Brummel,Frasco ,"9,95 €"
4269,4269,Multiusos ph neutro Las 3 Brujas,Botella ,"2,35 €"
4271,4271,Enjuague bucal protección dientes y encías Listerine menta fresca,Botella ,"4,80 €"
4275,4275,Enjuague bucal fresh explosion Deliplus sensación fuerte,Botella ,"1,49 €"
4276,4276,Enjuague bucal cuidado total Listerine menta fresca,Botella ,"5,40 €"
4277,4277,Enjuague bucal gingival Deliplus con clorhexidina,Botella ,"1,95 €"
4279,4279,Enjuague bucal encías sanas Deliplus con hexetidina,Botella ,"1,95 €"
4281,4281,Champú Bucle Perfect Deliplus cabello rizado,Bote ,"1,80 €"
4282,4282,Spray bucal Deliplus,Paquete ,"1,25 €"
4285,4285,Dentífrico pro-expert Oral-B con flúor menta fresca,Tubo ,"2,99 €"
4286,4286,Cepillo dental medio Deliplus,Paquete ,"1,00 €"
4288,4288,Dentífrico original Colgate total con flúor,Tubo ,"2,49 €"
4289,4289,Dentífrico protección caries Colgate,Tubo ,"1,75 €"
4291,4291,Cepillo dental duro Deliplus,Paquete ,"1,00 €"
4292,4292,Cepillo dental suave Deliplus,Paquete ,"1,00 €"
4295,4295,Dentífrico crema fluorada Kemphor original,Tubo ,"1,65 €"
4296,4296,Dentífrico repair & protect Sensodyne con flúor,Tubo ,"4,15 €"
4298,4298,Cepillo dental infantil Disney Henry el monstruo feliz Sp.Berner,Paquete ,"0,90 €"
4299,4299,Dentífrico max white one Colgate,Tubo ,"2,70 €"
4300,4300,Cepillos interdentales cónicos Deliplus extrafinos,Paquete ,"1,50 €"
4301,4301,Cepillo dental infantil Disney Junior Vampirina Deliplus,Paquete ,"0,90 €"
4303,4303,Hilo dental con cera y sabor menta,Paquete ,"1,80 €"
4304,4304,Dentífrico protección diaria Sensodyne,Tubo ,"3,50 €"
4306,4306,Cepillo dental medio todo en uno Oral-B,Paquete ,"2,80 €"
4310,4310,Dentífrico dientes sensibles Deliplus con flúor,Tubo ,"1,00 €"
4312,4312,Dentífrico herbal original Colgate,Tubo ,"1,75 €"
4314,4314,Cinta dental con cera y sabor menta,Paquete ,"2,50 €"
4316,4316,Dentífrico gel fresh clorofila Deliplus 2 en 1,Bote ,"0,85 €"
4318,4318,Recambios cepillo dental eléctrico Oral-B precision clean,Paquete ,"9,95 €"
4319,4319,Dentífrico gel fresh Deliplus con flúor,Tubo ,"0,90 €"
4320,4320,Dentífrico protección caries Colgate maximum menta fresca,Tubo ,"1,99 €"
4323,4323,Cepillo dental encías y dientes sensibles Deliplus,Paquete ,"1,35 €"
4324,4324,Cepillos interdentales cónicos Deliplus finos,Paquete ,"1,50 €"
4325,4325,Dentífrico menta fresca Licor del Polo 2 en 1,Bote ,"2,10 €"
4327,4327,Cepillo dental medio ultraavanzado Deliplus,Paquete ,"1,99 €"
4328,4328,Dentífrico gingival Deliplus con flúor,Tubo ,"1,20 €"
4329,4329,Dentífrico max fresh Colgate,Tubo ,"2,05 €"
4331,4331,Recambios cepillo dental eléctrico Sp.Berner,Paquete ,"3,95 €"
4333,4333,Cepillo dental infantil eléctrico Vengadores,Paquete ,"3,95 €"
4334,4334,Tabletas limpiadoras prótesis dentales Polident,Caja ,"4,70 €"
4335,4335,Cepillo dental eléctrico Oral-B Pro expert,Paquete ,"9,95 €"
4337,4337,Crema fijadora prótesis dentales Polident fijación fuerte,Tubo ,"4,95 €"
4338,4338,Cepillo dental infantil eléctrico Santoro Gorjuss Sp.Berner,Paquete ,"3,95 €"
4339,4339,Cepillo dental especial ortodoncia Deliplus,Paquete ,"1,85 €"
4340,4340,Recambios cepillo dental eléctrico Oral-B tri Zone,Paquete ,"10,90 €"
4341,4341,Cepillo dental eléctrico Sp.Berner,Paquete ,"6,90 €"
4342,4342,Cepillo dental eléctrico Deliplus desechable,Paquete ,"3,60 €"
4343,4343,Cepillo dental plegable de viaje Deliplus,Paquete ,"1,00 €"
4345,4345,Cepillo dental técnico especial prótesis Sp.Berner,Paquete ,"1,80 €"
4346,4346,Buey de mar cocido Errigal congelado,Pieza ,"7,25 €"
4354,4354,Mozzarella di bufala campana Hacendado,Tarrina ,"1,70 €"
4359,4359,Limpiador de calzado grasa de caballo Búfalo,Tarro ,"2,20 €"
4360,4360,Masa para empanadillas y postres Buitoni,Paquete ,"0,89 €"
4363,4363,Lote corporal mujer Flor de Mayo Rose Bulgarian,Caja ,"7,95 €"
4366,4366,Burger de vacuno,Bandeja ,"3,50 €"
4367,4367,Burger de pollo,Bandeja ,"3,50 €"
4368,4368,Burger de pavo y espinacas,Bandeja ,"1,95 €"
4369,4369,Burger de vacuno y cerdo,Bandeja ,"3,35 €"
4370,4370,Burger de vacuno gruesas,Bandeja ,"3,00 €"
4371,4371,Burger de pollo rural gruesas,Bandeja ,"3,00 €"
4372,4372,Burrata fresca Hacendado,Tarrina ,"2,20 €"
4373,4373,Burger de vacuno y cerdo con jamón y cebolla caramelizada,Bandeja ,"1,90 €"
4374,4374,Burger de pavo y pollo,Bandeja ,"3,52 €"
4375,4375,Burger de pollo con zanahoria,Bandeja ,"1,95 €"
4377,4377,"Burger de pollo, cerdo y verdura",Bandeja ,"2,95 €"
4378,4378,Burger de vacuno y cerdo gruesas,Bandeja ,"2,60 €"
4380,4380,Burger de cerdo ibérico gruesas,Bandeja ,"2,81 €"
4382,4382,Mini burgers de pollo,Bandeja ,"1,50 €"
4383,4383,Mini burgers de vacuno y cerdo,Bandeja ,"1,55 €"
4384,4384,Salsa burger Hacendado,Bote ,"1,25 €"
4385,4385,Queso fresco Burgos desnatado Hacendado 0% materia grasa,"6 tarrinas x 62,5 g","1,49 €"
4387,4387,Queso fresco Burgos natural Hacendado,2 tarrinas x 250 g,"1,59 €"
4388,4388,Queso fundido burger Hacendado lonchas,Paquete ,"1,40 €"
4390,4390,Queso fresco Burgos sin lactosa Hacendado,"4 tarrinas x 62,5 g","1,55 €"
4391,4391,Queso fresco Burgos desnatado Hacendado 0% materia grasa,2 tarrinas x 250 g,"1,59 €"
4392,4392,Sazonador para burritos Hacendado,Sobre ,"0,79 €"
4393,4393,Queso fresco Hacendado Burgos natural,"6 tarrinas x 62,5 g","1,49 €"
4395,4395,Mascarilla facial de burbujas Montagne Jeunesse,Paquete ,"1,50 €"
4397,4397,Bebida energética original Burn,Lata ,"0,98 €"
4399,4399,Perfilador de labios Deliplus 02 burdeos,1 ud.,"2,50 €"
4400,4400,Laca de uñas My Soul Deliplus 903 burdeos,1 ud.,"3,50 €"
4401,4401,Lote hombre Bustamante Muy mío,Caja ,"6,95 €"
4402,4402,Lote mujer Bustamante Muy mía,Caja ,"5,90 €"
4403,4403,Eau de toilette hombre Bustamante Muy mío Sport,Frasco ,"6,95 €"
4404,4404,Eau de toilette hombre Bustamante Muy mío,Frasco ,"5,60 €"
4405,4405,Longaniza magro fresca,Bandeja ,"2,73 €"
4406,4406,Longaniza fresca de pollo,Bandeja ,"3,10 €"
4407,4407,Longaniza de payés Hacendado lonchas,"2 paquetes x 62,5 g","1,50 €"
4408,4408,Butifarra fresca,Bandeja ,"3,16 €"
4409,4409,Longaniza fresca sin tripa,Bandeja ,"2,27 €"
4410,4410,Longaniza de Pascua Hacendado,2 paquetes x 145 g,"3,00 €"
4411,4411,Longaniza Hacendado sticks para picar,Paquete ,"1,00 €"
4413,4413,Butifarra fresca de pagés con pimienta,Bandeja ,"4,39 €"
4415,4415,Butifarra catalana Hacendado lonchas,Paquete ,"1,55 €"
4416,4416,Longaniza criollo fresca,Bandeja ,"2,73 €"
4417,4417,Longaniza clásica extra Hacendado,1 ud.,"2,20 €"
4419,4419,Butifarra de huevo Hacendado,Pieza ,"2,55 €"
4420,4420,Longaniza de payés Hacendado,1 ud.,"4,10 €"
4423,4423,Butifarra negra Hacendado,Pieza ,"2,56 €"
4424,4424,Longaniza roja fresca rosca,Bandeja ,"2,44 €"
4425,4425,Desodorante roll-on sensitive Byly,50 ml,"1,74 €"
4426,4426,Desodorante en crema sensitive seda Byly,Tubo ,"2,40 €"
4427,4427,Cabecero de lomo Hacendado lonchas,"4 paquetes x 31,25 g","1,72 €"
4431,4431,Cabecero de lomo Hacendado,Pieza ,"4,32 €"
4432,4432,Caballa Verdel a filetes sin cabeza y sin tripa,Pieza ,"1,88 €"
4433,4433,Caballa Verdel a rodajas sin cabeza y sin tripa,Pieza ,"1,88 €"
4434,4434,Caballa Verdel sin cabeza y sin tripa,Pieza ,"1,88 €"
4435,4435,Caballa Verdel sin tripa,Pieza ,"1,88 €"
4436,4436,Queso cabra Entrepinares lonchas,Paquete ,"2,46 €"
4440,4440,Laca cabello Nelly,Spray ,"1,80 €"
4441,4441,Langostino caballitos rebozados Hacendado ultracongelados,Paquete ,"2,95 €"
4442,4442,Laca cabello ultra fuerte Pantene fijación 5,Spray ,"2,95 €"
4450,4450,Spray cabello ondas surferas todo tipo de cabello Deliplus fijación 2,Spray ,"2,70 €"
4452,4452,Laca cabello normal todo tipo de cabello Deliplus fijación 2,Spray ,"1,60 €"
4454,4454,Laca cabello extra fuerte todo tipo de cabello Deliplus fijación 4,Spray ,"1,60 €"
4455,4455,"Cápsulas cabello, uñas Deliplus",Caja ,"3,95 €"
4459,4459,Laca cabello Elnett fijación fuerte,Spray ,"6,90 €"
4462,4462,Laca cabello fuerte todo tipo de cabello Deliplus fijación 4,Spray ,"1,60 €"
4466,4466,Laca cabello extra fuerte todo tipo de cabello Deliplus fijación 4,Spray ,"1,05 €"
4471,4471,Queso de cabra Hacendado rulo,Paquete ,"1,90 €"
4472,4472,Queso de cabra semicurado Montesinos,Pieza ,"4,16 €"
4475,4475,Queso de cabra Montesinos,2 tarrinas x 100 g,"2,70 €"
4480,4480,Merluza del cabo sin cabeza Hacendado congelada,Pieza ,"3,74 €"
4481,4481,Vino tinto Cabernet Sauvignon Don Simón,3 minibricks x 250 ml,"1,28 €"
4485,4485,Espuma ultrafuerte cabello con ondas y rizos Giorgi fijación 4,Spray ,"2,45 €"
4487,4487,Mousse fijador cabello rizado Deliplus fijación 2,Bote ,"2,70 €"
4489,4489,Protector térmico cabello Deliplus fijación 1,Spray ,"3,00 €"
4490,4490,Lenguado sin cabeza y sin piel,Pieza ,"2,54 €"
4491,4491,Queso fresco de cabra Hacendado,Tarrina ,"2,20 €"
4492,4492,Yogur natural de cabra y oveja,2 ud. x 125 g,"1,40 €"
4493,4493,Medallones de queso cabra Président,Paquete ,"2,65 €"
4494,4494,Champú Detox Deliplus cabello graso,Bote ,"1,95 €"
4495,4495,Infusión cola de caballo Hacendado,Caja ,"1,20 €"
4496,4496,Leche semidesnatada de cabra Hacendado,Brick ,"1,26 €"
4497,4497,Champú Hydra Deliplus cabello normal,Bote ,"1,80 €"
4498,4498,Champú Silver Deliplus cabello blanco y platino,Bote ,"2,70 €"
4499,4499,Cava semi seco Cabré & Sabaté,Botella ,"1,95 €"
4500,4500,Leche semidesnatada de cabra Hacendado,6 bricks x 1 L,"7,56 €"
4505,4505,Champú Restructuring Deliplus cabello extremadamente dañado,Bote ,"2,75 €"
4506,4506,Champú Volumen Deliplus cabello fino y sin volumen,Bote ,"1,80 €"
4508,4508,Cápsulas cola de caballo Deliplus,Caja ,"4,50 €"
4510,4510,Espuma ondas marcadas cabello rizado Deliplus fijación 3,Bote ,"1,99 €"
4513,4513,Cava semi seco Cabré & Sabaté,4 benjamines x 200 ml,"4,35 €"
4514,4514,Espuma máximo volumen cabello fino y sin volúmen Deliplus fijación 3,Bote ,"1,99 €"
4516,4516,Lubina limpia con cabeza,Pieza ,"3,13 €"
4517,4517,Dorada limpia con cabeza,Pieza ,"3,82 €"
4518,4518,Filetes de merluza del cabo sin piel Mascato ultracongelados,Paquete ,"3,85 €"
4520,4520,Medallones de merluza del cabo Hacendado ultracongelados,Paquete ,"3,60 €"
4521,4521,Filetes lomo de cerdo cabeza,Bandeja ,"2,97 €"
4522,4522,Porciones de merluza del cabo Hacendado ultracongeladas,Paquete ,"3,80 €"
4523,4523,Champú repara & protege Pantene cabello débil y dañado,Bote ,"2,99 €"
4526,4526,Filetes de merluza del cabo sin piel Hacendado ultracongelados,Paquete ,"6,30 €"
4528,4528,Champú Repair & Nutrition Deliplus cabello seco y dañado,Bote ,"1,80 €"
4529,4529,Champú hidratación intensa TRESemmé cabello seco o dañado,Botella ,"4,65 €"
4532,4532,Rodajas de rape del cabo sin piel Mascato congeladas,Paquete ,"6,75 €"
4533,4533,Champú total repair Elvive cabello dañado,Bote ,"2,95 €"
4534,4534,Champú color vive Elvive cabello teñido o con mechas,Bote ,"2,95 €"
4535,4535,Filetes de merluza del cabo grandes sin piel Hacendado ultracongelados,Paquete ,"7,25 €"
4538,4538,Champú cuidado clásico TRESemmé cabello normal o graso,Botella ,"4,65 €"
4539,4539,Champú liso & sedoso Pantene cabello encrespado o seco,Bote ,"2,99 €"
4540,4540,Rodajas de merluza del cabo Hacendado ultracongeladas,Paquete ,"3,95 €"
4543,4543,Champú Intense & Gold Deliplus cabello rubio,Bote ,"1,80 €"
4544,4544,Pescadilla de merluza del cabo sin cabeza Mascato ultracongelada,Paquete ,"3,95 €"
4548,4548,Cacahuete frito Hacendado,Paquete ,"0,85 €"
4552,4552,Cacao puro en polvo La Chocolatera,Bote ,"2,70 €"
4553,4553,Cacao soluble instantáneo Nesquik,Paquete ,"4,59 €"
4554,4554,Cacahuete frito con miel Hacendado,Paquete ,"1,70 €"
4556,4556,Cacao soluble instantáneo Nesquik,Bote ,"2,38 €"
4557,4557,Cacao soluble CaoBon,Bote ,"2,49 €"
4558,4558,Cacahuetes Hacendado chocolate negro,Paquete ,"1,75 €"
4559,4559,Cacao soluble Cola Cao original,Bote ,"4,99 €"
4563,4563,Cacahuetes Hacendado chocolate con leche,Paquete ,"1,75 €"
4564,4564,Cacao soluble instantáneo Hacendado,Paquete ,"2,98 €"
4565,4565,Cacao soluble Cola Cao original,Bote ,"2,89 €"
4566,4566,Cacao soluble Cola cao original,Caja ,"13,95 €"
4569,4569,Cacahuete tostado con sal Hacendado,Paquete ,"1,25 €"
4570,4570,Cacao soluble instantáneo Nesquik,Caja ,"12,40 €"
4572,4572,Cacao en polvo a la taza Valor,Paquete ,"2,49 €"
4574,4574,Cacao en polvo a la taza Hacendado,Paquete ,"1,25 €"
4575,4575,Cacahuete garrapiñado Hacendado,Paquete ,"1,15 €"
4576,4576,Cacao soluble instantáneo Hacendado,Bote ,"1,99 €"
4577,4577,Cacao en polvo instantáneo a la taza Hacendado,Bote ,"1,79 €"
4578,4578,Cacao soluble CaoBon,Bote ,"1,90 €"
4579,4579,Cacao soluble en sobres CaoBon,Caja ,"1,00 €"
4580,4580,Calabaza cacahuete cortada a trozos,Paquete ,"1,71 €"
4581,4581,Calabaza cacahuete,Pieza ,"1,43 €"
4582,4582,99% cacao extrafino negro Hacendado,Tableta ,"1,75 €"
4585,4585,Crema de cacahuete 100% Hacendado,Bote ,"3,00 €"
4587,4587,Crema al cacao con avellanas Nutella,Tarro ,"2,75 €"
4591,4591,Crema al cacao con avellanas Nocilla original,Tarro ,"2,85 €"
4592,4592,Espiral al cacao Hacendado,70 g aprox.,"0,26 €"
4593,4593,Crema al cacao con avellanas Hacendado,Bote ,"1,65 €"
4594,4594,Media calabaza cacahuete,1/2 Pieza ,"0,93 €"
4597,4597,Crema al cacao con avellanas Nocilla original,Bote ,"4,88 €"
4600,4600,Crema al cacao y leche con avellanas Nocilla,Tarro ,"2,85 €"
4601,4601,Crema al cacao con avellanas Hacendado de 2 sabores,Bote ,"1,65 €"
4602,4602,Crema de cacao y avellanas Pralinutta,Bote ,"2,45 €"
4605,4605,Crema al cacao y leche con avellanas Nocilla,Bote ,"4,88 €"
4606,4606,Galletas de cacao sin gluten rellenas de crema Hacendado,Paquete ,"2,50 €"
4614,4614,Huevo crema al cacao,25 g,"0,90 €"
4615,4615,Hojaldre relleno de cacao Hacendado,55 g aprox.,"0,21 €"
4618,4618,Caña de crema al cacao Hacendado,100 g aprox.,"0,38 €"
4620,4620,Vasito con crema de cacao Choco Snack Hacendado con palitos de pan,2 vasitos x 55 g,"0,98 €"
4623,4623,Preparado lácteo cereales al cacao Peques 3 Puleva,3 mini bricks x 200 ml,"1,41 €"
4624,4624,Napolitanas con crema de cacao Hacendado,Paquete ,"1,09 €"
4625,4625,Limpiador de ollas y cacerolas Bosque Verde,Botella ,"1,50 €"
4626,4626,Cereales rellenos de crema de cacao y avellana sin gluten Hacendado,Paquete ,"1,90 €"
4627,4627,Helado de nata y galleta cacao Hacendado,Tarrina ,"2,45 €"
4628,4628,Papilla instantánea 8 cereales con cacao Nestlé +12 meses,Caja ,"3,59 €"
4630,4630,Vino tinto D.O Rioja Marqués de Cáceres crianza,Botella ,"7,30 €"
4632,4632,Chocolate extrafino negro Hacendado con pepitas de cacao tostadas,Tableta ,"0,90 €"
4633,4633,Galletas mini caritas Hacendado con crema de cacao,Caja ,"1,45 €"
4634,4634,Galletas crujientes sin gluten rellenas de crema de cacao Hacendado,Caja ,"2,00 €"
4637,4637,Chocolate líquido a la taza Hacendado,Brick ,"1,58 €"
4641,4641,Chocolate con leche Crunchie Rocks Cadbury con copos de maíz y trozos de caramelo,Paquete ,"1,20 €"
4643,4643,Café en cápsula ristretto L'Or Espresso,Caja ,"3,40 €"
4644,4644,Café en cápsula extra fuerte Hacendado Espresso,Caja ,"3,74 €"
4645,4645,Café en cápsula sontuoso L'Or Espresso,Caja ,"3,40 €"
4646,4646,Café en cápsula descafeinado ristretto L'Or Espresso,Caja ,"3,40 €"
4647,4647,Café en cápsula descafeinado Hacendado Espresso,Caja ,"3,74 €"
4648,4648,Café en cápsula espresso intenso Dolce Gusto,Caja ,"4,25 €"
4649,4649,Café en cápsula fuerte Hacendado Espresso,Caja ,"3,74 €"
4650,4650,Café en cápsula Colombia Hacendado Espresso,Caja ,"3,80 €"
4651,4651,Café molido natural Hacendado,Paquete ,"1,05 €"
4652,4652,Café con leche cappuccino Hacendado,Vaso ,"0,78 €"
4653,4653,Café soluble natural Nescafé classic,Tarro ,"5,25 €"
4654,4654,Café molido natural Hacendado,2 paquetes x 500 g,"4,05 €"
4655,4655,Café en cápsula lungo Hacendado,Caja ,"3,74 €"
4656,4656,Café molido mezcla fuerte Hacendado,2 paquetes x 500 g,"4,45 €"
4657,4657,Café soluble clásico Hacendado,Bote ,"1,90 €"
4658,4658,Café en cápsula ristretto Hacendado Espresso,Caja ,"3,74 €"
4659,4659,Café en cápsula extra forte Cocatech,Paquete ,"3,40 €"
4660,4660,Café con leche en cápsula Dolce Gusto,Caja ,"4,25 €"
4661,4661,Café molido natural Hacendado Espresso,Paquete ,"1,85 €"
4662,4662,Café con leche espresso Hacendado,Vaso ,"0,78 €"
4663,4663,Café en cápsula classic Hacendado Espresso,Caja ,"3,74 €"
4665,4665,Café en cápsula descafeinado espresso intenso Dolce Gusto,Caja ,"4,25 €"
4667,4667,Café con leche light sin lactosa Hacendado,Vaso ,"0,87 €"
4668,4668,Café soluble descafeinado Hacendado,Bote ,"2,49 €"
4669,4669,Café en cápsula forte Cocatech,Paquete ,"3,40 €"
4670,4670,Café molido mezcla Marcilla crème express,Caja ,"3,29 €"
4671,4671,Café molido descafeinado natural Hacendado,Paquete ,"1,25 €"
4672,4672,Café molido mezcla fuerte Hacendado,Paquete ,"1,19 €"
4674,4674,Café soluble descafeinado Nescafé classic,Tarro ,"5,95 €"
4675,4675,Café con leche en cápsula Cocatech,Paquete ,"3,40 €"
4676,4676,Café con leche descafeinado Hacendado,Vaso ,"0,78 €"
4677,4677,Café en cápsula classic Cocatech,Paquete ,"3,40 €"
4678,4678,Café en cápsula descafeinado Cocatech,Paquete ,"3,40 €"
4679,4679,Café en cápsula forza L'Or Espresso,Caja ,"3,40 €"
4680,4680,Café molido descafeinado mezcla Hacendado,Paquete ,"2,50 €"
4681,4681,Café en grano natural Hacendado,Paquete ,"5,95 €"
4682,4682,Café en cápsula ristretto napoli Dolce Gusto,Caja ,"4,25 €"
4683,4683,Café en cápsula espresso Tassimo,Paquete ,"4,52 €"
4684,4684,Café en cápsula cortado Dolce Gusto,Caja ,"4,25 €"
4685,4685,Café molido Colombia Hacendado,Paquete ,"2,45 €"
4686,4686,Café molido mezcla Hacendado Espresso,Paquete ,"1,85 €"
4687,4687,Café molido descafeinado Hacendado Espresso,Paquete ,"2,10 €"
4688,4688,Café molido descafeinado natural Hacendado,Paquete ,"2,46 €"
4689,4689,Café molido natural Hacendado,Paquete ,"2,05 €"
4690,4690,Café con leche en cápsula descafeinado Dolce Gusto,Caja ,"4,25 €"
4691,4691,Café molido descafeinado mezcla Hacendado,Paquete ,"1,29 €"
4692,4692,Café en cápsula cappuccino Dolce Gusto,Caja ,"4,25 €"
4693,4693,Café soluble espresso crema Hacendado,Bote ,"1,50 €"
4694,4694,Café soluble descafeinado Nescafé classic,Tarro ,"3,87 €"
4695,4695,Café molido mezcla fuerte Hacendado,Paquete ,"2,30 €"
4696,4696,Café soluble natural Nescafé classic,Tarro ,"3,41 €"
4697,4697,Café molido natural fuerte Hacendado,Paquete ,"1,19 €"
4698,4698,Café en cápsula largo Tassimo,Paquete ,"4,52 €"
4699,4699,Café molido intenso Hacendado,Paquete ,"1,90 €"
4700,4700,Café soluble cappuccino Nescafé,Bote ,"3,53 €"
4701,4701,Café monodosis mezcla Hacendado,Paquete ,"2,60 €"
4702,4702,Café en cápsula cortado descafeinado Dolce Gusto,Caja ,"4,25 €"
4703,4703,Café monodosis natural Hacendado,Paquete ,"2,15 €"
