,Unnamed: 0,title,quantity,price
0,0,Cerveza Abadía tostada Hélécine,Botellín ,"1,25 €"
1,1,Cerveza abadía Tongerlo,Botellín ,"1,00 €"
2,2,Cerveza abadía Tongerlo,4 botellines x 330 ml,"4,00 €"
3,3,Filetes de abadejo de Alaska sin piel Hacendado ultracongelados,Paquete ,"4,95 €"
4,4,Vino blanco verdejo D.O Rueda Abadía Mantrús,Botella ,"2,20 €"
5,5,Vino tinto D.O Ribera del Duero Abadía Mantrús crianza,Botella ,"3,80 €"
6,6,Vino tinto D.O Ribera del Duero Abadía Mantrús roble,Botella ,"3,15 €"
7,7,Vino tinto D.O Costers del Segre Raimat Abadía tempranillo,Botella ,"6,99 €"
8,8,Gel reductor abdomen 9.60 hombre,Bote ,"3,70 €"
9,9,Caldo de pollo Hacendado,2 bricks x 1 L,"1,64 €"
10,10,Caldo casero de pollo Gallina Blanca,Brick ,"1,80 €"
11,11,Caldo de verduras Hacendado,Brick ,"1,00 €"
12,12,Caldo para paella de marisco o fideuá Hacendado con sofrito,Brick ,"1,95 €"
13,13,Caldo de pescado Hacendado,2 bricks x 1 L,"2,20 €"
14,14,Caldo de cocido Hacendado,Brick ,"0,90 €"
15,15,Caldo de pollo en pastillas,Caja ,"0,82 €"
16,16,Caldo de verduras en pastillas,Caja ,"0,44 €"
17,17,Caldo de pescado Hacendado,Brick ,"1,20 €"
18,18,Caldo de pollo Avecrem en pastillas,Caja ,"2,60 €"
19,19,Caldo casero de carne Gallina Blanca,Brick ,"1,80 €"
20,20,Caldo de carne Hacendado en pastillas,Caja ,"0,82 €"
21,21,Caldo de pescado Hacendado en pastillas,Caja ,"0,50 €"
22,22,Caldo de pollo Hacendado,Brick ,"0,90 €"
23,23,Caldo para paella de carne Hacendado con sofrito,Brick ,"1,95 €"
24,24,Caldo de pollo Hacendado bajo en sal,Brick ,"1,05 €"
25,25,Caldo casero de escudella Gallina Blanca,Brick ,"1,80 €"
26,26,Caldo para fideuá o arroz negro Hacendado con sofrito,Brick ,"1,95 €"
27,27,Caldo de pollo reducido en sal Hacendado en pastillas,Caja ,"0,70 €"
28,28,Doble caldo sabor clásico carne Knorr en pastillas,Caja ,"1,25 €"
29,29,Caracoles en caldo Helifrusa,Bandeja ,"3,00 €"
30,30,Cera depilatoria natural de abeja Veet piel normal,Caja ,"8,25 €"
31,31,Sopa de pollo Gallina Blanca con fideos finos,Sobre ,"0,55 €"
32,32,Sopa de miso,Paquete ,"1,45 €"
33,33,Tallarines a la parmesana Hacendado,Sobre ,"1,10 €"
34,34,Sopa de ave Gallina Blanca con fideos,Sobre ,"0,55 €"
35,35,Sopa de cebolla Hacendado,2 sobres x 50 g,"0,75 €"
36,36,Sopa de pollo Hacendado con fideos finos,2 sobres x 71 g,"0,75 €"
37,37,Sopa maravilla Hacendado,2 sobres x 91 g,"0,70 €"
38,38,Tallarines a la carbonara Hacendado,Sobre ,"1,10 €"
39,39,Sopa de ave Hacendado con fideos,2 sobres x 82 g,"0,70 €"
40,40,Codornices abiertas,Bandeja ,"2,61 €"
41,41,Salmón abierto en libro sin cabeza y sin espina,Pieza ,"26,85 €"
42,42,Lubina abierta en libro sin cabeza y sin espina,Pieza ,"3,13 €"
43,43,Lubina abierta a la espalda con espinas y con cabeza,Pieza ,"3,13 €"
44,44,Dorada abierta en libro sin cabeza y sin espina,Pieza ,"3,82 €"
45,45,Dorada abierta a la espalda con espinas y con cabeza,Pieza ,"3,82 €"
46,46,Rape abierto en libro sin espina,Pieza ,"19,90 €"
47,47,Bacalao abierto en libro sin cabeza y sin espina,Pieza ,"13,86 €"
48,48,Trucha abierta en libro sin cabeza y sin espina,Pieza ,"3,25 €"
49,49,Trucha abierta en libro con cabeza,Pieza ,"3,25 €"
50,50,Salmón media pieza abierto en libro sin cabeza y sin espina,1/2 Pieza ,"14,32 €"
51,51,Bacalao media pieza abierto en libro sin cabeza y sin espina,1/2 Pieza ,"7,43 €"
52,52,Abrillantador lavavajillas líquido,Botella ,"1,25 €"
53,53,Abrillantador lavavajillas Finish líquido,Botella ,"4,45 €"
54,54,Abrillantador suelos Bosque Verde,Botella ,"2,05 €"
55,55,Abrillantador muebles con aceites nutrientes Bosque Verde,Botella ,"3,30 €"
56,56,Abrillantador multiusos Bosque Verde,Spray ,"1,49 €"
57,57,Aceite abrillantador acero inoxidable y aluminio Bosque Verde,Botella ,"3,79 €"
58,58,Crema abrillantadora acero inoxidable y aluminio Bosque Verde,Botella ,"2,25 €"
59,59,Plataforma mopa grande abrillantadora Bosque Verde,Paquete ,"2,70 €"
60,60,Absorbeolores Bosque Verde Marsella,1 ud.,"0,60 €"
61,61,Absorbeolores Bosque Verde flores blancas,1 ud.,"0,60 €"
62,62,Absorbeolores Bosque Verde lavanda,1 ud.,"0,60 €"
63,63,Absorbeolores Bosque Verde cítrico,1 ud.,"0,60 €"
64,64,Absorbeolores en gel para frigorífico Bosque Verde,Paquete ,"1,80 €"
65,65,Lecho absorbente para gato Single antibacterias,Paquete ,"3,50 €"
66,66,Discos absorbentes lactancia Deliplus,Caja ,"5,95 €"
67,67,Vodka Absolut,Botella ,"12,65 €"
68,68,Fregona microfibra absorbente Bosque Verde,Paquete ,"2,95 €"
69,69,Papel hogar absorbente Bosque Verde,Paquete ,"2,50 €"
70,70,Fregona microfibra absorbente Bosque Verde,Paquete ,"1,60 €"
71,71,Papel hogar compacto absorbente Bosque Verde,Paquete ,"1,78 €"
72,72,Papel hogar compacto absorbente Bosque Verde,Paquete ,"3,55 €"
73,73,Papel cocina gigante absorbente Bosque Verde,Paquete ,"2,60 €"
74,74,Fregona resistente y absorbente Bosque Verde,Paquete ,"1,75 €"
75,75,Papel hogar super absorbente Bosque Verde,Paquete ,"2,10 €"
76,76,Servilleta papel decorada suavidad y absorción Bosque Verde,Paquete ,"1,67 €"
77,77,Recambio antihumedad Bosque Verde con aromas cítricos,Caja ,"2,10 €"
78,78,Ambientador eliminador de olores Bosque Verde ropa limpia,Botella ,"1,20 €"
79,79,Set antihumedad Bosque Verde con aromas cítricos,1 ud.,"3,35 €"
80,80,Tarta de la abuela Hacendado congelada,10 raciones (825 g),"7,50 €"
81,81,Tarta de la abuela Hacendado congelada,"20 raciones (1,9 kg)","11,50 €"
82,82,Bebida aromatizada a base de vino para cocinar Abuela Carola,Botella ,"1,99 €"
83,83,Insecticida ácaros Bosque Verde especial tejidos,Spray ,"2,80 €"
84,84,Dentífrico acción total Deliplus con flúor,Tubo ,"0,95 €"
85,85,Cápsulas acción memoria Deliplus,Caja ,"3,10 €"
86,86,Dentífrico triple acción Colgate con flúor,Tubo ,"1,75 €"
87,87,Enjuague bucal acción total Deliplus menta fresca,Botella ,"1,35 €"
88,88,Corrector fluido acción global Deliplus 01,1 ud.,"4,00 €"
89,89,Corrector fluido acción global Deliplus 02,1 ud.,"4,00 €"
90,90,Maquillaje fluido Deliplus acción global 03,30 ml,"5,50 €"
91,91,Maquillaje fluido Deliplus acción global 04,30 ml,"5,50 €"
92,92,Maquillaje fluido Deliplus acción global 02,30 ml,"5,50 €"
93,93,Maquillaje fluido Deliplus acción global 01,30 ml,"5,50 €"
94,94,Toallitas lavadora Bosque Verde acción 2 en 1,Paquete ,"1,95 €"
95,95,Esponja de baño doble acción suave masaje Deliplus,Paquete ,"0,99 €"
96,96,Eau de toilette hombre 9.60 Sport water acción,Frasco ,"3,90 €"
97,97,Crema facial anti-edad integral L'Oréal men expert Vita lift 5 acciones,Bote ,"10,95 €"
98,98,Gasas para bebé no tejidas Deliplus,Paquete ,"1,97 €"
99,99,"Solución fisiológica salina 0,9 % Deliplus",Caja ,"3,23 €"
100,100,Esponja anatómica para bebés Deliplus,Paquete ,"0,80 €"
101,101,Polvos de talco bebé Deliplus,Bote ,"1,25 €"
102,102,Esponja marina infantil Deliplus,Caja ,"3,75 €"
104,104,Pincel coloración cabello Deliplus,1 ud.,"1,25 €"
105,105,Bol coloración cabello Deliplus,1 ud.,"1,00 €"
106,106,Quitamanchas de tinte capilar Azalea,Bote ,"2,50 €"
107,107,Set bebé cepillo y peine azul +0 meses Deliplus,Paquete ,"2,40 €"
108,108,Recambios recarga aspirador nasal anatómico Deliplus,Paquete ,"3,15 €"
109,109,Set bebé cepillo y peine rosa +0 meses Deliplus,Paquete ,"2,40 €"
110,110,Tijeras infantiles anatómicas +0 meses Deliplus,Paquete ,"2,50 €"
111,111,Aspirador nasal anatómico +0 meses Deliplus,Paquete ,"3,95 €"
112,112,Espuma cabello Azalea color plata,Spray ,"3,40 €"
113,113,Estuche de bebé para rellenar Alcograf,Caja ,"1,50 €"
114,114,Gomas negras Deliplus,1 ud.,"0,95 €"
115,115,Toalla turbante seca pelo microfibra Deliplus,Caja ,"2,95 €"
116,116,Gomas varios colores Deliplus,6 ud.,"0,95 €"
117,117,Gorro de ducha Deliplus,Paquete ,"2,50 €"
118,118,Pinza cabello varios colores Deliplus mediana,1 ud.,"1,00 €"
119,119,Pinza cabello varios colores Deliplus grande,1 ud.,"1,75 €"
120,120,Pinza cabello peluquería Deliplus,Paquete ,"1,90 €"
121,121,Coleteros varios colores Deliplus,5 ud.,"1,95 €"
122,122,Clip negro Deliplus,24 ud.,"1,50 €"
123,123,Turbante varios colores Deliplus,1 ud.,"1,75 €"
124,124,Clip rubio Deliplus,24 ud.,"1,50 €"
125,125,Ranas varios colores Deliplus,6 ud.,"1,00 €"
126,126,Coleteros infantiles varios colores Deliplus,5 ud.,"1,95 €"
127,127,Coletero para recogido negro Deliplus,1 ud.,"1,60 €"
128,128,Horquilla rubia Deliplus,Paquete ,"1,50 €"
129,129,Horquilla negra Deliplus,Paquete ,"1,50 €"
130,130,Rulo 20 mm Deliplus,Paquete ,"2,50 €"
131,131,Rulo 28 mm Deliplus,Paquete ,"2,75 €"
132,132,Redecilla castaña Deliplus,Paquete ,"1,50 €"
133,133,Coletero para recogido castaño Deliplus,1 ud.,"1,60 €"
134,134,Redecilla negra Deliplus,Paquete ,"1,50 €"
135,135,Redecilla rubia Deliplus,Paquete ,"1,50 €"
136,136,Rulo 40 mm Deliplus,Paquete ,"2,80 €"
137,137,Peine grande Deliplus,Paquete ,"1,00 €"
138,138,Peine gel Deliplus,Paquete ,"1,25 €"
139,139,Cepillo cabello neumático Deliplus,1 ud.,"1,50 €"
140,140,Cepillo cabello neumático y esqueleto Deliplus,2 ud.,"1,75 €"
141,141,Peine afro Deliplus,1 ud.,"1,50 €"
142,142,Cepillo cabello antitirones infantil Frozen II,Paquete ,"5,50 €"
143,143,Cepillo cabello esqueleto Deliplus,1 ud.,"1,50 €"
144,144,Peine lendrera Deliplus,Paquete ,"2,00 €"
145,145,Cepillo cabello térmico iónico Deliplus 44 mm,1 ud.,"3,00 €"
146,146,Cepillo cabello de madera Deliplus,1 ud.,"2,50 €"
147,147,Cepillo cabello térmico iónico Deliplus 35 mm,1 ud.,"3,00 €"
148,148,Cepillo cabello térmico iónico Deliplus 25 mm,1 ud.,"3,00 €"
149,149,"Aceite de oliva 0,4º Hacendado",Botella ,"2,50 €"
150,150,"Aceite de girasol refinado 0,2º Hacendado",Botella ,"0,99 €"
151,151,Aceite de oliva virgen extra Hacendado,Botella ,"3,50 €"
152,152,Aceitunas negras Hacendado sin hueso,Bote ,"0,85 €"
153,153,Aceite de oliva virgen extra Hacendado,Garrafa ,"9,50 €"
154,154,"Aceite de oliva 0,4º Hacendado",Garrafa ,"11,00 €"
155,155,Aceitunas manzanilla rellenas de anchoa Hacendado,6 botes x 50 g,"2,15 €"
156,156,Aceitunas rellenas de anchoa Hacendado reducido en sal,Bote ,"0,84 €"
157,157,Aceite de oliva virgen extra Hacendado Gran Selección,Botella ,"3,69 €"
158,158,Aceitunas manzanilla rellenas de anchoa Hacendado,3 botes x 150 g,"1,98 €"
159,159,"Aceite de girasol refinado 0,2º Hacendado",Garrafa ,"4,79 €"
160,160,Acelgas cortadas,Paquete ,"1,00 €"
161,161,Aceitunas manzanilla rellenas de anchoa Hacendado reducidas en sal,3 botes x 50 g,"1,80 €"
162,162,Aceitunas estilo caseras Hacendado partidas aliñadas,Tarro ,"2,35 €"
163,163,Aceitunas negras cacereñas Hacendado a rodajas,3 botes x 50 g,"1,50 €"
164,164,Aceite de oliva 1º Hacendado,Botella ,"2,50 €"
165,165,Aceitunas manzanilla Hacendado sin hueso,3 paquetes x 75 g,"1,30 €"
166,166,Aceitunas manzanilla Hacendado sin hueso,Tarro ,"1,60 €"
167,167,Aceitunas chupadedos Huerta de Barros partidas aliñadas con hueso,Tarro ,"2,70 €"
168,168,Aceitunas rellenas de anchoa Hacendado,Bote ,"3,10 €"
169,169,Aceite de oliva virgen extra Hacendado,Spray ,"2,15 €"
170,170,Acelgas,Paquete ,"1,80 €"
171,171,Aceitunas rellenas de anchoa Hacendado,Bote ,"1,15 €"
172,172,Aceitunas negras naturales de Aragón Hacendado,Tarro ,"1,70 €"
173,173,Aceitunas gazpacha Hacendado con hueso,Tarro ,"2,10 €"
174,174,Aceite de oliva 1º Hacendado,Garrafa ,"11,00 €"
175,175,Aceite de coco virgen Hacendado,Bote ,"4,50 €"
176,176,Aceite de oliva virgen Hacendado,Botella ,"3,15 €"
177,177,Aceite de oliva virgen Hacendado,Garrafa ,"8,00 €"
178,178,Aceitunas negras Hacendado con hueso,Bote ,"0,75 €"
179,179,"Aceite de semillas refinado 0,2º Hacendado",Botella ,"1,53 €"
180,180,Aceitunas manzanilla Hacendado con hueso,Tarro ,"1,47 €"
181,181,Aceitunas rellenas de limón Hacendado,Bote ,"1,30 €"
182,182,Aceitunas manzanilla aliñadas Hacendado sin hueso,Tarro ,"1,50 €"
183,183,Aceitunas rellenas de jalapeño Hacendado,Bote ,"1,25 €"
184,184,Aceitunas rellenas con pepinillo Hacendado,Tarro ,"1,99 €"
185,185,Acelgas al natural troceadas Mis delicias,Tarro ,"1,00 €"
186,186,Aceitunas Hacendado en rodajas,Bote ,"1,00 €"
187,187,Aceitunas rellenas de pimiento asado Hacendado,Bote ,"0,90 €"
188,188,Aceitunas aloreña Roldán partida con hueso,Bote ,"2,89 €"
189,189,Aceite de oliva virgen extra Eminente,Garrafa ,"13,95 €"
190,190,"Aceite de oliva 0,4º Borges",Botella ,"3,99 €"
191,191,Aceitunas manzanilla sabor anchoa Hacendado con hueso,Tarro ,"2,50 €"
192,192,Acelga en porciones Hacendado ultracongelada,Paquete ,"0,75 €"
193,193,Aceite de girasol refinado Borges,Botella ,"1,88 €"
194,194,Aceite de oliva virgen extra Hacendado,Botella ,"2,35 €"
195,195,Aceite de oliva virgen extra Borges,Botella ,"4,75 €"
196,196,Aceitunas rellenas de pimiento Hacendado,3 botes x 50 g,"1,60 €"
197,197,Aceitunas manzanilla sabor anchoa Hacendado con hueso,Tarro ,"1,00 €"
198,198,Aceitunas aliñadas Hacendado sin hueso,Tarro ,"2,40 €"
199,199,Aceitunas gordal Hacendado con hueso,Tarro ,"2,10 €"
200,200,Acelga hoja en porciones Hacendado ultracongelada,Paquete ,"1,65 €"
201,201,Aceite árbol del té Deliplus 100% puro,Bote ,"3,50 €"
202,202,Aceite seco secreto de belleza 24K gold progress Deliplus,70 ml,"6,85 €"
203,203,Aceite corporal aloe vera Deliplus,Bote ,"1,65 €"
204,204,Aceite corporal rosa mosqueta Deliplus,Bote ,"4,99 €"
205,205,Aceite corporal de almendras Deliplus 100% natural,Bote ,"3,20 €"
206,206,Aceitunas con salsa mojo picón Iruela sin hueso,Tarro ,"3,75 €"
207,207,"Aceite de oliva, vinagre y sal Merry",15 monodosis x 10 ml,"1,32 €"
208,208,"Aceite de semillas refinado 0,2º Hacendado",Garrafa ,"7,15 €"
209,209,Aceite de oliva virgen extra Arbequina Borges,Botella ,"2,99 €"
210,210,Aceitunas Ye-Ye Guerra con hueso,Cubo ,"3,00 €"
211,211,Aceitunas arrugadas negras de Aragón Campo Nature,Tarro ,"2,20 €"
212,212,Aceite corporal bebé con aloe vera Johnson's,Botella ,"3,49 €"
213,213,Aceite bronceador de coco Deliplus,Spray ,"4,10 €"
214,214,Aceite protector Deliplus FPS 30,Spray ,"6,50 €"
215,215,Aceite de aguacate Ethnos,Botella ,"5,00 €"
216,216,Aceite en crema oriental Deliplus para el cuerpo,Bote ,"3,00 €"
217,217,Aceite corporal de romero Deliplus 100% natural,Bote ,"3,20 €"
218,218,Aceite multiusos Bosque Verde,Spray ,"1,95 €"
219,219,Aceite corporal tacto seco Deliplus,Bote ,"3,50 €"
220,220,Aceite en crema flores blancas Deliplus para el cuerpo,Bote ,"3,00 €"
222,222,Aceite corporal infantil Deliplus,Bote ,"2,90 €"
223,223,Aceite protector Delial FPS 20,Spray ,"7,95 €"
224,224,Aceite facial desmaquillante 24 K gold progress Deliplus pieles secas,Bote ,"5,10 €"
225,225,Aceite corporal reparador estrías y cicatrices Deliplus,Bote ,"6,00 €"
226,226,Estropajo acero inoxidable Bosque Verde,Paquete ,"0,70 €"
227,227,Gel aceite de baño Deliplus pieles átopicas,Botella ,"3,25 €"
228,228,Quitaesmalte acetona pura Deliplus,Bote ,"1,50 €"
229,229,Perlas aceite de onagra Deliplus,Caja ,"3,95 €"
230,230,Sardinillas en aceite de oliva Hacendado,2 latas x 65 g,"1,25 €"
231,231,Sardinas en aceite de oliva Hacendado,2 latas x 82 g,"1,30 €"
232,232,Atún en aceite de girasol Hacendado,Lata ,"5,35 €"
233,233,Tortas de aceite Inés Rosales,Paquete ,"1,39 €"
234,234,Mortadela con aceitunas Hacendado lonchas,Paquete ,"0,95 €"
235,235,Atún en aceite de oliva Hacendado,Lata ,"6,75 €"
236,236,"Aliño de aceite, ajo y perejil Hacendado",Tarrina ,"1,20 €"
237,237,Quitaesmalte con acetona Deliplus,Bote ,"1,00 €"
238,238,Tortas de aceite Inés Rosales sin azúcar,Paquete ,"1,80 €"
239,239,Sardinillas en aceite de girasol Hacendado,2 latas x 65 g,"1,15 €"
240,240,Sardinas en aceite de girasol Hacendado,2 latas x 82 g,"1,10 €"
241,241,Pulpo en aceite de oliva Hacendado,Lata ,"3,75 €"
242,242,Galantina con aceituna y pimiento Hacendado finas lonchas,Paquete ,"1,36 €"
243,243,Quitaesmalte sin acetona Deliplus,Bote ,"1,20 €"
244,244,Agujas en aceite de oliva Hacendado,Lata ,"1,25 €"
246,246,Atún claro en aceite de oliva Hacendado,6 latas x 60 g,"3,99 €"
247,247,Atún claro en aceite de girasol Hacendado,6 latas x 56 g,"3,50 €"
248,248,Atún claro en aceite de oliva Hacendado,Bote ,"3,35 €"
249,249,Crema corporal con aceite de oliva Deliplus,Tarro ,"1,25 €"
250,250,Atún claro en aceite de oliva Hacendado,3 latas x 60 g,"2,15 €"
251,251,Noodles de arroz Acecook,Paquete ,"1,25 €"
252,252,Atún claro en aceite de oliva Hacendado,Lata ,"1,31 €"
253,253,Atún claro en aceite de girasol Hacendado,3 latas x 56 g,"1,79 €"
254,254,Tomate seco en aceite,Tarro ,"2,00 €"
255,255,Crema corporal con aceite de argán Deliplus,Tarro ,"2,00 €"
256,256,Atún claro en aceite de girasol Hacendado,Lata ,"1,74 €"
257,257,Mortadela veggie con aceitunas Noel lonchas,Paquete ,"1,19 €"
258,258,Tratamiento para uñas aceite vitamínico Deliplus,1 ud.,"2,95 €"
259,259,Mortadela veggie con aceitunas Noel,Pieza ,"2,49 €"
261,261,Barra pan de aceite de oliva rebanada,1 ud. (200 g),"0,44 €"
262,262,Barra pan de aceite de oliva,1 ud. (200 g),"0,44 €"
263,263,Tomate frito Hacendado con aceite de oliva,3 mini bricks x 210 g,"0,92 €"
264,264,Filetes de anchoa en aceite de oliva Hacendado,3 bandejas x 29 g,"2,50 €"
265,265,Bonito del norte en aceite de oliva Hacendado,2 latas x 73 g,"2,28 €"
266,266,Filetes de anchoa en aceite de girasol Hacendado,3 bandejas x 29 g,"1,65 €"
267,267,Filetes de melva en aceite de oliva Hacendado,Lata ,"1,70 €"
268,268,Bonito del norte en aceite de oliva Hacendado,Lata ,"1,55 €"
269,269,Cereales solubles con achicoria Hacendado,Bote ,"1,59 €"
270,270,Ampollas faciales ácido hialurónico Deliplus concentrado,Caja ,"3,50 €"
271,271,Sérum facial ultra hidratante Deliplus con ácido hialurónico,Bote ,"7,00 €"
272,272,Crema facial renovadora dermik Deliplus con ácido glicólico,Tarro ,"6,00 €"
273,273,Aclarante crema color L'Oréal 03 rubio ultra claro ceniza,Caja ,"7,95 €"
274,274,Aclarante crema color L'Oréal 01 rubio ultra claro natural,Caja ,"7,95 €"
275,275,Mascarilla sin aclarado Hydra Deliplus cabello normal,Bote ,"2,75 €"
276,276,Mascarilla sin aclarado Argan Oil Deliplus cabello seco y dañado,Bote ,"4,05 €"
277,277,Mascarilla sin aclarado Bucle Perfect Deliplus cabello rizado,Bote ,"4,05 €"
278,278,Mascarilla sin aclarado Repair & Nutrition Deliplus cabello seco y dañado,Bote ,"4,05 €"
279,279,Gel de manos higienizante sin aclarado,Bote ,"1,70 €"
280,280,Mascarilla facial equilibrante Deliplus pieles grasas y con tendencia acnéica,Bote ,"3,80 €"
281,281,Acondicionador repara & protege Pantene,Bote ,"2,99 €"
282,282,Acondicionador Repair & Nutrition Deliplus cabello seco y dañado,Bote ,"1,40 €"
283,283,Acondicionador instantáneo Volumen Deliplus cabello fino y sin volumen,Botella ,"2,50 €"
284,284,Acondicionador instantáneo Repair & Nutrition Deliplus cabello seco y dañado,Botella ,"2,50 €"
285,285,Acondicionador suavidad y brillo Deliplus todo tipo de cabello,Botella ,"0,90 €"
286,286,Acondicionador hidratación intensa TRESemmé cabello seco o dañado,Bote ,"4,65 €"
287,287,Acondicionador instantáneo Kids Deliplus,Bote ,"1,70 €"
288,288,Acondicionador total repair Elvive,Bote ,"2,79 €"
289,289,Acondicionador Hydra Deliplus cabello normal,Bote ,"1,40 €"
290,290,Acondicionador Liss Frizz Control Deliplus cabello rebelde,Bote ,"1,40 €"
291,291,Acondicionador liso keratina TRESemmé,Bote ,"4,65 €"
292,292,Acondicionador protector color vive Elvive cabello teñido,Bote ,"2,79 €"
293,293,Acondicionador de cuero Bosque Verde limpiador y nutriente,Spray ,"3,85 €"
294,294,Papel higiénico acolchado Bosque Verde,Paquete ,"2,93 €"
295,295,Champú y acondicionador anticaspa H&S clásico,Bote ,"2,99 €"
296,296,Azúcar moreno de caña Acor,Caja ,"1,87 €"
297,297,Azúcar blanco en sobres Acor,Caja ,"1,15 €"
298,298,Lote hombre Alejandro Sanz Mi acorde,Caja ,"13,95 €"
299,299,Lote mujer Alejandro Sanz Mi acorde,Caja ,"13,95 €"
300,300,Azúcar moreno de caña integral en sobres Acor,Caja ,"1,30 €"
301,301,Eau de toilette hombre Alejandro Sanz Mi acorde,Frasco ,"12,95 €"
302,302,Eau de toilette mujer Alejandro Sanz Mi acorde,Frasco ,"12,95 €"
303,303,Mascarilla Repair & Nutrition Deliplus cabello seco y dañado,Tarro ,"2,05 €"
304,304,Mascarilla Argan Oil Deliplus cabello seco y dañado,Tarro ,"2,75 €"
305,305,Mascarilla cabello dañado Pantene repara & protege,Tarro ,"4,25 €"
306,306,Mascarilla Bucle Perfect Deliplus cabello rizado,Tarro ,"2,50 €"
307,307,Mascarilla cabello rizado Fructis hidra rizos fortificante,Tarro ,"3,95 €"
308,308,Mascarilla cabello encrespado Pantene liso & sedoso,Tarro ,"4,25 €"
309,309,Mascarilla Liss Frizz Control Deliplus cabello rebelde,Tarro ,"2,50 €"
310,310,Sérum Restructuring Deliplus cabello extremadamente dañado,Bote ,"4,05 €"
311,311,Mascarilla cabello dañado Elvive total repair,Tarro ,"4,50 €"
312,312,Ampollas cabello Pantene,Caja ,"4,75 €"
313,313,Mascarilla Natural Deliplus todo tipo de cabello,Bote ,"2,75 €"
315,315,Mascarilla cabello liso keratina TRESemmé nutritiva,Tarro ,"4,80 €"
316,316,Mascarilla Color Intense Deliplus cabello teñido o con mechas,Tarro ,"2,50 €"
317,317,Mascarilla cabello Elvive color vive,Tarro ,"4,50 €"
318,318,Mascarilla Silver Deliplus cabello blanco y platino,Bote ,"3,95 €"
320,320,Mascarilla cabello seco o dañado TRESemmé hidratante,Tarro ,"5,00 €"
321,321,Mascarilla Be Radiant Deliplus cabello apagado,Tarro ,"2,75 €"
322,322,Mascarilla Restructuring Deliplus cabello extremadamente dañado,Bote ,"2,95 €"
323,323,Sérum Be Radiant 10 en 1 Deliplus cabello apagado,Bote ,"4,05 €"
324,324,Bálsamo exfoliante capilar Detox Deliplus todo tipo de cabello,Bote ,"2,10 €"
326,326,Sérum Vital Therapy DD Cream Deliplus cabello apagado y sin vida,Bote ,"4,05 €"
327,327,Hidrocrema Liss Frizz Control Deliplus cabello rebelde,Bote ,"2,75 €"
329,329,Perfume capilar Hair Mist Deliplus,Bote ,"2,50 €"
330,330,Sérum Repair & Nutrition Deliplus cabello seco y dañado,Bote ,"4,05 €"
331,331,Loción Intense & Gold Deliplus cabello rubio,Bote ,"4,95 €"
332,332,Mascarilla Vital Therapy Deliplus cabello apagado y sin vida,Bote ,"2,95 €"
333,333,Sérum Natural Deliplus todo tipo de cabello,Bote ,"4,05 €"
334,334,Sérum Anticaída Men Deliplus,Bote ,"6,95 €"
335,335,Bebida láctea de fresa L-casei,12 mini botellas x 100 g,"2,49 €"
336,336,Bebida láctea de fresa y plátano Hacendado,Botella ,"1,16 €"
337,337,Bebida láctea sabores L-casei,12 mini botellas x 100 g,"2,49 €"
338,338,Bebida láctea de fresa Cuidacol 0% azúcares añadidos,8 mini botellas x 100 g,"2,50 €"
339,339,Bebida láctea desnatada omega 3 Puleva,6 bricks x 1 L,"8,34 €"
340,340,Bebida láctea desnatada omega 3 Hacendado,6 bricks x 1 L,"5,40 €"
341,341,Bebida láctea natural azucarada L-casei,6 mini botellas x 100 g,"1,25 €"
342,342,Bebida láctea de fresa y plátano Actimel Kids,6 mini botellas x 100 g,"2,99 €"
343,343,Bebida láctea natural Cuidacol 0% azúcares añadidos,8 mini botellas x 100 g,"2,50 €"
344,344,Bebida láctea natural Actimel,12 mini botellas x 100 g,"4,79 €"
345,345,Bebida láctea de fresa L-casei 0% materia grasa 0% azúcares añadidos,6 mini botellas x 100 g,"1,50 €"
346,346,Bebida láctea natural Danacol 0% azúcares añadidos,10 mini botellas x 100 g,"4,74 €"
347,347,Bebida láctea de fresa Hacendado,Botella ,"1,16 €"
348,348,Activador del lavado ropa de color Bosque Verde en gel,Botella ,"1,60 €"
349,349,Bebida láctea de piña y coco Hacendado,Botella ,"1,16 €"
350,350,Bebida láctea con fresa y plátano Hacendado,Botella ,"1,74 €"
351,351,Bebida láctea natural Actimel 0% materia grasa,12 mini botellas x 100 g,"4,79 €"
352,352,Bebida láctea natural L-casei 0% materia grasa 0% azúcares añadidos,6 mini botellas x 100 g,"1,50 €"
353,353,Bebida láctea sabor canela y limón Hacendado,Botella ,"1,33 €"
354,354,Bebida láctea de frutas del bosque Hacendado,Botella ,"1,74 €"
355,355,Bebida láctea con cacao y cereales crecimiento y desarrollo Puleva Max,3 mini bricks x 200 ml,"1,30 €"
356,356,Bebida láctea sin lactosa de fresa Hacendado,4 botellas x 160 g,"1,40 €"
357,357,Bebida láctea de fresa Actimel 0% materia grasa,6 mini botellas x 100 g,"2,99 €"
358,358,Bebida láctea de fresa Danacol 0% azúcares añadidos,10 mini botellas x 100 g,"4,74 €"
359,359,Bebida láctea de frutos silvestres L-casei,6 mini botellas x 100 g,"1,25 €"
360,360,Bebida láctea desnatada omega 3 Puleva,Brick ,"1,39 €"
361,361,Activador blanqueante ropa blanca Bosque Verde en polvo,Bote ,"3,05 €"
362,362,Bebida láctea crecimiento y desarrollo Puleva Max,6 bricks x 1 L,"7,92 €"
363,363,Activador del lavado oxy blanco puro Neutrex líquido,Botella ,"1,69 €"
364,364,Bebida láctea + proteínas sabor chocolate Hacendado,Brick ,"1,20 €"
365,365,Bebida láctea sabor canela y limón Hacendado,6 mini bricks x 200 ml,"1,71 €"
366,366,Bebida láctea natural azucarada Hacendado,Botella ,"1,74 €"
367,367,Activador del lavado oxy color Neutrex líquido,Botella ,"1,69 €"
368,368,Activador del lavado ropa blanca Bosque Verde en gel,Botella ,"1,93 €"
369,369,Bebida láctea tropical Danacol 0% azúcares añadidos,10 mini botellas x 100 g,"4,74 €"
370,370,Bebida láctea + proteínas sabor vainilla Hacendado,Brick ,"1,20 €"
371,371,Bebida láctea de fresa Densia Forte 0% materia grasa,4 mini botellas x 100 g,"1,52 €"
372,372,Bebida láctea crecimiento y desarrollo Puleva Max,Brick ,"1,32 €"
